title,tag,score,y
Sopir Taksi Daring Terancam Bui 10 Tahun,news,1,0
Pilot audio of final moments before helicopter crash. RIP Kobe.,news,1,0
Pilot audio final moments before helicopter crash. RIP Kobe.,news,1,0
ఇక నుంచి అరటి పండు తినవద్దు: దాని యొక్క ఆరోగ్య ప్రయోజనాలు మరియు పోషక విలువలు తెలుసా?,news,1,0
buy ios installs,news,1,0
"Wuhan virus: Singapore confirms 2 more new cases, bringing total number infected to 7.",news,1,0
‘Like I’m trapped’: Africans in China lockdown see no escape,news,1,0
Judi QQ,news,1,0
Free Training From Wesley Virgin &amp;amp; Ariella Iorio,news,1,0
Father charged with killing 5 of his infant children over a decade in California,news,1,0
curso de cocina online,news,1,0
How Equity Investment Helps in Saving Tax?,news,1,0
"4,500 Infected with Coronavirus, 100 dead, shortage of tests kits has experts worried number may be higher.",news,1,0
Nicholas Parsons: Broadcaster dies aged 96 after short illness,news,1,0
A moment of silence for a fallen comedy ledgend,news,1,0
Transcript of conversation between pilot Ara Zobayan and air traffic control in Kobe Bryant crash (The Washington Post),news,1,0
Bolton blows the impeachment case back open,news,1,0
Luxury Interior Portable Cabins in Australia,news,1,0
"'Tanhaji' still prevails at the box office, know where 'Panga' reached and 'Street Dancer 3D'",news,1,0
An international study in Quaternary Science Reviews has sought to bring some order into our understanding of giant straight-tusked elephant,news,1,0
Is only healthy diet plan can help you in losing weight? - Healthy Diet Plan for Weight Gain and Loss,news,1,0
CEO questioned over stock sale ahead of story on asbestos in Baby Powder,news,1,0
Albuquerque Web Design,news,1,0
Dosen UB Ini jadi Saksi Awal Mula Merebaknya Virus Corona di Wuhan,news,1,0
Legendary Enlargement: A Scientific Penis Enlargement System to Add 2-4 Inches in Length and Girth to your penis,news,1,0
דבר חזירים אפריקאי - המחלה החדשה שמאיימת על תעשיית החזירים בארצות הברית,news,1,0
"Century Next Bank - At CNext, we are dedicated to build relationships and provide services with a personal touch. Our Experienced lenders will help you to find a right loan for you.",news,1,0
Advantages of Fenugreek Seeds for Weight loss - Healthy Diet Plan for Weight Gain and Loss,news,1,0
Why it is Important to Have Interview Preparation Book,news,1,0
பிக்பாஸ் பிரபலத்தின் தந்தை மரணம்.. சோகத்தில் ரசிகர்கள்,news,1,0
Zero FIR implementation: Telangana HC gives one month to DGP to clarify,news,1,0
"Commuter chaos as Arctic blast brings ice, sleet and up to six inches of snow to parts of UK",news,1,0
"JAV Uncensored, Free Jav Uncensored HD Porn Streaming Online 2020 - JAV.SH",news,1,0
Irvine Body Contouring,news,1,0
"Aviation, Cabin Crew And Airport Management",news,1,0
Income tax searches against Polisetty Somasundaram group,news,1,0
OrthoAtlanta Orthopedic and Sports Medicine Care for the Entire Family,news,1,0
Nigerian Lady Dragged On Twitter For Saying Kobe Bryant And Daughter Deserved To Die,news,1,0
"@rokambola : Post Edited: RansomFree, protégete del ransomware de forma totalmente gratuita http://bit.ly/2qSmjeO",news,1,0
The Pacific Ocean is so acidic that it's dissolving Dungeness crabs' shells,news,1,0
Apple Growing Region Himachal - Rajat Biotech,news,1,0
Why 1917 should win the best picture Oscar,news,1,0
New Research Challenges Conventional Wisdom In Brewing Strong Espresso,news,1,0
"Today on Fox News: Jan. 28, 2020",news,1,0
Hong Kong to Suspend High-Speed Rail Service in Bid to Halt Spread of Coronavirus,news,1,0
"Gaganyaan will be milestone for New India, says PM",news,1,0
"YS Vivekananda Reddy's murder case: daughter seeks CBI probe,files PIL in AP HC",news,1,0
Portable Buildings Rent To Own,news,1,0
Republican senator says he wants to see Bolton’s manuscript,news,1,0
"Desist From Taking Your Marital Issues To Pastors - Ghanaian Gospel Singer, Gifty Adorye",news,1,0
@rokambola : Impresionante autobús eléctrico de dos pisos http://bit.ly/2Ryou5u,news,1,0
Kesaksian Mahasiswa Indonesia di Wuhan: Psikis Down dan Logistik Menurun,news,1,0
TMI Academy,news,1,0
Best nail paint shades for Olive and Medium skin tones - BlogOnBox- Latest Current Affairs | Trending Blogs | Latest Updates,news,1,0
How to Go on Working with Government Contracts Consultant,news,1,0
Stephen King: Oscars 'rigged in favor of the white folks',news,1,0
"Coronavirus updates January 28, 2020 Caught on tape",news,1,0
KPAI Mengecam Prostitusi Anak di Kafe,news,1,0
Dhanush Posts Karnan New Look Poster! Hot update on his next movie!,news,1,0
"Spies v MPs on Huawei deal: MI5, MI6 and GCHQ tell Boris Johnson to press ahead with 5G deal",news,1,0
Basketball Icon Kobe Bryant died on Sunday in a helicopter crash - BlogOnBox- Latest Current Affairs | Trending Blogs | Latest Updates,news,1,0
3 Reasons for Homeowners to Hardscape in East Tennessee,news,1,0
Online Poker Strategy – Thinking Like a Poker Player,news,1,0
Kerala Lottery Result Today Sthree Sakthi (SS-194) live 28.01.2020,news,1,0
BREAKING: China complains after Danish newspaper publishes image of Chinese flag with coronavirus,news,1,0
Rain Gutter Replacement Installation Repair Cleaning Commercial Clearwater,news,1,0
Regulatory framework for related-party transactions,news,1,0
@rokambola : Post Edited: La Canción del día (09/08/2016) http://bit.ly/36vkaYP,news,1,0
"Wuhan Coronavirus Infections Could Be 30 Times Higher, Researcher Says",news,1,0
NHRC directs enquiry into 'fanaticism and terrorism in Islam is more' comments by Telangana cop,news,1,0
Suspect Handcuffed With His Arms Behind His Back Shot and Killed in Police Cruiser,news,1,0
Dying Light: Bad Blood free to all owners of Dying Light on all platforms,news,1,0
The Use of Animation in Digital Marketing,news,1,0
Barty excited but ignoring the hype,news,1,0
Cheapest Courier to China,news,1,0
Grammy awards: Priyanka Chopra's Grammy White Dress did not digest Indian fans at all,news,1,0
जल्दी देखो और पाओ जॉब | सरकारी नौकरियाँ | Government Job | पुरे देश मे ...,news,1,0
"Chimney where Ohio teen was found dead has been removed, police say",news,1,0
​ក្តៅៗ អ្នកជំនាញថាជំងឺកូរ៉ូណាអាចមិនមែនកើតចេញពីសត្វប្រចៀវនោះទេគឺចិនជា​អ្ន...,news,1,0
Windows 7 a pus din nou Microsoft intr-o Situatie PENIBILA,news,1,0
Government Project Management Unit (PMU) - GOTT,news,1,0
"Polyurethane Elastomers Market : Global forecast to 2022 by Type, Application and Region",news,1,0
Steps to Get Registered with Sam for Federal Business,news,1,0
"F-bombs and death threats: Kobe Bryant, Mike Pompeo and the abuse of women journalists",news,1,0
Benefits of Decorating Your Event with Balloon Arch and Column Kits,news,1,0
Microsoft Secures Patent For An Environment-Friendly Artificial Reef Data..,news,1,0
SC recuses from hearing Centre’s plea for additional fund – Bhopal gas tragedy,news,1,0
"Fact Check: No, Coronavirus does not spread through frozen food",news,1,0
Are You Ready for Letting Your Property on Rent for Commercial Purposes? - ArticleScad,news,1,0
Future of Connectivity: Industrial Transformation in 5G Networking,news,1,0
Trump 2020: Novel 365 days messages: Scotland 'centre of world consideration',news,1,0
Anuj Goel Pune | Why Goel Ganga Developments Homes Are Perfect For Your Family,news,1,0
"The Cast Of 'Cheer' On Boyfriends, ""Broken Backgrounds"" &amp; Life After Making Mat",news,1,0
Are You Ready For Letting Your Property On Rent For Commercial Purposes? - 123ArticleOnline,news,1,0
🔵В метро Харькова задержали мужчину с гранатой,news,1,0
NTSB Sends Team To Investigate Kobe Bryant Helicopter Crash,news,1,0
"Nollywood Movie Continuity Manager, Juwon Shot Dead By Gun Men In Ilorin",news,1,0
Off With Their Heads!,news,1,0
Microsoft Secures Patent For An Environment-Friendly Artificial Reef Data..,news,1,0
What level dangerous is the coronavirus — Forbes,news,1,0
Cheap Courier to India,news,1,0
"Kesulitan Pemasaran dan Akses Permodalan, Paguyuban Batik Kabupaten Malang Mengadu ke Dr Sri Untari",news,1,0
Government of India - Government of Assam - Bodo Agreement,news,1,0
Are You Ready For Letting Your Property on Rent For Commercial Purposes? - SooperArticles,news,1,0
Snow tracker LIVE: Britain facing 5 INCH flurry in 'treacherous' snow deluge - latest maps | Weather | News,news,1,0
Iranian airliner skids into street; all 150 passengers safe,news,1,0
Person in Japan who has not visited Wuhan contracts coronavirus - minister,news,1,0
Shouting neighbourly support in virus-hit Wuhan,news,1,0
Tips on Keeping Your Luxury Car Running Smoothly,news,1,0
Змијанац: Општ пад на моралните и семејните вредности,news,1,0
Enrich Your Small Business With Proper Small Business,news,1,0
தலைவரே கொல மாஸ்.. புகைப்படத்துடன் தனது அடுத்த பட தலைப்பை அறிவித்த தனுஷ்,news,1,0
Make Profit with Short Let Apartments - ArticleScad,news,1,0
New Zealand PM Jacinda Ardern IGNORES a call from Scott Morrison at a coronavirus press conference,news,1,0
Asifnagar cop draws flak for ‘congratulatory’ tweet to BJP MP,news,1,0
Reporters and Activists Are Being Harassed for Saying Kobe Bryant Was Credibly Accused of Rape,news,1,0
Make Profit With Short Let Apartments - 123ArticleOnline,news,1,0
Hyundai Aura: First drive,news,1,0
"B-2 Spirit: The $2 billion ""flying wing"" design that makes it invisible to radar",news,1,0
gambling software developers,news,1,0
Best Way to Switch Off McAfee Account activation Notifications?,news,1,0
Germany identifies first case of coronavirus,news,1,0
Squid Fossil Offers A Rare Look At The Diet Of A Pterosaur,news,1,0
Washington Post journalist suspended after tweeting about Kobe Bryant rape case hours after his death,news,1,0
Snakes could be the original source of the new coronavirus outbreak in China,news,1,0
The New Movies &amp; Shows On Netflix This Week Include The End Of A Beloved Series,news,1,0
"Venus comes closer to Earth, seen beside moon",news,1,0
Firasatnya Sebelum Johny Indo Meninggal,news,1,0
Best Race Group in Australia,news,1,0
Vermont proposes bill to allow emojis on license plates,news,1,0
Math genius Villani frustrates Macron's effort to win Paris,news,1,0
"@rokambola : Todo sobre Popcorn Time, la app que te permite ver películas gratis online http://bit.ly/2t4Y4yX http://bit.ly/2U4Ffa6",news,1,0
Should You Invest in Long Let Property? - ArticleScad,news,1,0
Sumur Injeksi Diyakini Mampu Kurangi Banjir Hingga 40 Persen,news,1,0
"Kashmiri families based in Hyderabad, live with hope to go back to the valley",news,1,0
Brexit latest: Barnier demands EU judges keep control after Brexit | Politics | News,news,1,0
"Get Home Decor Ideas in Idaho with Modern Home! - Modern Home located in Idaho Falls, brings shoppers an exceptional value on spectacular collection of furniture, rugs, bedroom, and mattresses brands.Visit us Today!",news,1,0
"After PM Narendra Modi, superstar Rajinikanth will be seen in Bear Grylls 'Man vs Wild' show",news,1,0
டாஸ்மாக் கடைச் சுவரில் துளையிட்டு ரூ.2 லட்சம் மதிப்பிலான உயர் ரக மதுபாட்டில்கள் திருட்டு,news,1,0
dominoqq,news,1,0
"Two old satellites could collide over US, space debris tracker warns",news,1,0
Satellite image shows earthquake hit Raghunathapalem Village of Suryapet,news,1,0
Should You Invest In Long Let Property? - 123ArticleOnline,news,1,0
Onsite Chair Massage: Appointing the Best Massage Therapist,news,1,0
Tories pledge £500m to reopen Beeching lines,news,1,0
Midday news | दोपहर की फटाफट ख़बरें | Fatafat khabren | Today Headlines |...,news,1,0
@rokambola : Como Hacer Espaguetis con Mejillones en escabeche http://bit.ly/36BOAbT http://bit.ly/38CupfA,news,1,0
Should You Invest in Long Let Property? - SooperArticles,news,1,0
"More Than 4,000 Infected as Death Toll Surpasses 100",news,1,0
Man dies in wakeboarding accident in Pitt Town,news,1,0
Washington Post criticized for suspending reporter over Kobe Bryant tweets,news,1,0
DOJ disputes report on Bolton conversation with Barr about foreign leaders,news,1,0
How to Find the Accommodation in Malta - ArticleScad,news,1,0
Mobile App Development Company In Delhi,news,1,0
Superior Bathroom Renovations in Perth in Your Budget,news,1,0
स्वतंत्रता आंदोलन में काशी विद्यापीठ के छात्रों और शिक्षकों ने अहम भू...,news,1,0
How To Find The Accommodation In Malta - 123ArticleOnline,news,1,0
Petition calls for Kobe Bryant to be on NBA logo,news,1,0
1000 Pastors To Assemble In Kaduna To Pray For Leah Sharibu and Lawan Andimi,news,1,0
"2 dead at Rocky Mountain National Park were mother, toddler son",news,1,0
How to Find The Accommodation in Malta - SooperArticles,news,1,0
Debunking 3 Common Myths About Wood-Look Tiles You Must Know,news,1,0
FCC Approves 988 as Suicide Hotline Number,news,1,0
Taliban assault on Afghan police base kills 11,news,1,0
Former Belgian king admits he fathered a child in a 1960s affair,news,1,0
"Klaim Menang Praperadilan, Warga Blimbing Minta Polisi Lanjutkan Kasus Keterangan Palsu",news,1,0
Know the Benefits of GSA Schedule Before Applying,news,1,0
Father arrested in killings of 5 of his infant children,news,1,0
@Afriupdate_com: Markets suffer more losses as China virus death toll rises https://t.co/fBQ4abtqcQ https://t.co/dcosyzpOGS,news,1,0
Race Group in Australia,news,1,0
Bitter Remainers plot to make European Union anthem top the music charts on Brexit day | Politics | News,news,1,0
Russia expels Japanese journalist in military espionage row: RIA,news,1,0
CEO questioned over stock sale ahead of story on asbestos in Baby Powder,news,1,0
J&amp;amp;J CEO questioned over stock sale ahead of story on asbestos in Baby Powder,news,1,0
"For Fed, 'material reassessment' may be in eye of beholder",news,1,0
"Airbus agrees to settle corruption probes with France, Britain, U.S.",news,1,0
Top Tips to Renovate Your Bathroom From Dreary to Light and Bright,news,1,0
"He was bit by a shark. Four months later, 13-year-old Florida surfer wins major USA contest.",news,1,0
"Telangana Model Schools invite applications for Class VI, vacant seats from VII to X",news,1,0
Vermont may pass a bill to add Emojies to licence plates. Eggplant licence plates may be a real thing in the future.,news,1,0
தாலிபான் ஆட்டமா? எரிந்தபடி விழுந்து நொறுங்கிய அமெரிக்க போர் விமானம்.. விசாரிக்கும் பென்டகன்!,news,1,0
China coronavirus outbreak: All you need to know about this deadly virus,news,1,0
What is the coronavirus?,news,1,0
Now photo contest match face to face. Contest no.109 (24hours vote) Who is Best Please B for Vote,news,1,0
"Ada Corona, Mahasiswa Wuhan Dipulangkan",news,1,0
Husband arraigned for killing wife who Googled 'what to do if your husband is angry you're pregnant',news,1,0
Game On: Gopichand to play kabaddi coach in new film,news,1,0
How to Deal with a Crack in An Acrylic Bathtub? A Brief Discourse,news,1,0
Hot Tub Maintenance,news,1,0
@rokambola : Post Edited: Evento Pluvial del Carniense: La vez que llovió durante dos millones de años (vídeo) http://bit.ly/2L0pVU8,news,1,0
U.S. wants end to EU ban on 'chlorinated chicken' and hormone-treated beef,news,1,0
US military plane crashes in Afghanistan,news,1,0
Now photo contest match face to face. Contest no.109 (24hours vote) Who is Best Please B for Vote,news,1,0
"Career took off after French Open win over Serena, says Kenin",news,1,0
Why Jurgen Klopp’s refusal to manage Liverpool against Shrewsbury is problematic (Opinion),news,1,0
It wasn’t just Kobe.,news,1,0
A website that allows you to track the Coronavirus live.,news,1,0
CNN Don Lemon panel faces intense backlash for mocking Trump supporters as illiterate 'credulous rubes',news,1,0
"Boy, 10, who got 13-year-old girlfriend pregnant 'may not be dad' doctor claims",news,1,0
Tricks To Submit The Assignment On Time - IdealAssignmentHelp.com,news,1,0
Sharwanand has a 'field day' in first-look poster of Sreekaram,news,1,0
Facebook/Reddit Alternative,news,1,0
افضل عروض الطيران على الخطوط السعودية,news,1,0
Style of Business Promotion with Digital,news,1,0
Instant Back Pain Relief is backed with a 60 Day No Questions Asked Money Back Guarantee,news,1,0
The Irish President loves when people pet his dog.,news,1,0
War justified itself through religion: historian Manu S. Pillai in conversation,news,1,0
Best ORM company in Melbourne,news,1,0
A fiber media converter is a networking device that connects and transmits signals between fiber optic cable assemblies and other kinds of cables like Unshielded Twisted Pair (UTP) copper Ethernet cables.,news,1,0
"""Masturbation Is A Beautiful Thing, I Masturbate When Horny"" – 52-year-old Ghanaian Songstress",news,1,0
Sharjeel Imam (CAA Protest Mastermind) Wants to Get “Jinnah Wali Azadi”,news,1,0
Paul Perez: California Man Charged With Killing Five Of His Infant Children,news,1,0
"Man gets three-years jail for kidnap, rape of minor",news,1,0
Raja Keraton Agung Sejagat Disebut Lama Tinggal di Malang,news,1,0
@Afriupdate_com: Chad Da Don – Thula https://t.co/4L7YDdypBl https://t.co/fyutvHUZoD,news,1,0
"Coronavirus: what to do, what not to do to prevent infection",news,1,0
mobdro for firestick,news,1,0
Things to Consider for a Relaxing Reflexology Body Massage,news,1,0
Meghan Markle news: Sister says ‘it wasn’t about racism’ as she slams cruelty of 'Megxit' | Royal | News,news,1,0
Germany identifies first case of deadly coronavirus,news,1,0
Reporter throws Kobe away after death!,news,1,0
Kazakhstan restricts visa regime for Chinese over virus,news,1,0
"AP Legislative council : 18 YSRCP MLAs abstain from voting, Jagan fumes",news,1,0
Japan warns about risks to economy from China virus outbreak,news,1,0
"கோவை சிங்காநல்லூர் அருகே துணிகரம்: தொழிலதிபர் வீட்டில் 100 பவுன், ரூ.10 லட்சம் கொள்ளை",news,1,0
"Thailand confirms six more coronavirus infections, bringing total to 14: official",news,1,0
China records first virus death in Beijing as toll passes 100,news,1,0
Vertical Knowledge launches RPA Framework at BattleFin Miami 2020,news,1,0
What China doesn’t want you to see,news,1,0
FBI Investigating Whether Ilhan Omar Married Her Brother,news,1,0
WordPress Website Development Company Singapore | Dextra Technologies,news,1,0
Irish Prime Minister Leo Varadkar says UK will have 'weak position' in trade talks with EU,news,1,0
Ex-England footballer Sue Lopez blames her dementia diagnosis on heading the ball and urges a ban,news,1,0
Actors who sported school uniforms in movies,news,1,0
"Wuhan Coronavirus Infections Could Be 30 Times Higher, Researcher Says",news,1,0
buy ios installs,news,1,0
"BJP, Congress unite to prevent TRS in Manikonda Municipality",news,1,0
solarmovies,news,1,0
SANTETPOKER - FORMULA PENTING DALAM CAPSA SUSUN ONLINE,news,1,0
बसंत पंचमी 2020- ऐसे करे माँ सरस्वती की आराधना और करें उन्हें प्रसन्न,news,1,0
Mt. Juliet family’s dog stabbed 6 times by Metro officer | WKRN News 2,news,1,0
Chipotle fined $1.3M over thousands of child labor abuses,news,1,0
3 reasons why Tottenham Hotspur should not sign Steven Bergwijn,news,1,0
Reputation Management Companies in Clayton,news,1,0
Locksmith Fishkill,news,1,0
"Gordon Hayward recalls Kobe Bryant scoring 60 points on him in last game, debunks free-throw line rumor",news,1,0
@rokambola : Post Edited: Khan Academy agrega 21 aplicaciones educativas gratuitas para niños http://bit.ly/2t7i97M,news,1,0
Auckland University research looking for participants aged 16-21 to help with our understanding of using social media to give and receive support for mental health problems. Involves a digital interview and a $30 Prezzy card for those who participate.,news,1,0
"Nokia: SURPRIZA, va Lansa un Produs la care NU te Gandeai",news,1,0
Virus video game sees 'very high' player numbers in wake of coronavirus outbreak,news,1,0
"Pence Caught On Hot Mic Joking That Trump Is ""Unstoppable"" At World Holocaust Forum",news,1,0
"As the Lebanon Uprising Hits 100-Day Mark, Protesters Allege Torture by Security Forces",news,1,0
machine learning with python course training in hyderabad,news,1,0
CORROSION OF CONFORMITY Drummer Reed Mullin Dead At 53,news,1,0
"Reed Mullin, drummer for Corrosion of Conformity, dead at 53",news,1,0
LED Sreen Rentals - Top 10 Tips to Get the Best out of Them,news,1,0
Driving license of BMW car driver involved in Madhapur accident revoked,news,1,0
Tree snake with VERY appropriate name is caught in office paper shredder - after severing tail,news,1,0
Grammy 2020: Burna Boy Finally React After Losing Grammy Award To Angelique Kidjo,news,1,0
Digital Marketing Company,news,1,0
Coronavirus: Death toll climbs to 106 as China tightens measures,news,1,0
Penipuan Donny Jadi Dirut TransJakarta,news,1,0
FCC Approves 988 as Suicide Hotline Number,news,1,0
"Kerajaan Majapahit Akan Kembali Dilahirkan, Seorang Utusan Raja Cari Silsilah ke Singosari",news,1,0
Wuhan guy gets curbstomped by HK protesters for taking photos (NSFW),news,1,0
@Afriupdate_com: Sowore looks for volunteer teaching job in Abuja https://t.co/ILvW8m1iqW https://t.co/TRlpM0qBGP,news,1,0
Coronavirus news: Deadly virus death toll rise to 106 as cases of disease in China soar | World | News,news,1,0
Boeing and DirecTV are scrambling to move a satellite before it explodes,news,1,0
Debate in the European Parliament on India's citizenship law,news,1,0
WUHAN ESCAPE,news,1,0
IObit Driver Booster Pro 7.2.0.580 Crack + Serial Key &amp; Download 2020,news,1,0
Netflix’s ‘The Goop Lab’ Is Full of Pointless Stuff No One Is Supposed to Do,news,1,0
"Kobe Bryant’s Disturbing Rape Case: The DNA Evidence, the Accuser’s Story, and the Half-Confession",news,1,0
Odisha News,news,1,0
Lakers-Clippers clash postponed by NBA,news,1,0
How To Fix Sign-Up/Sign-In Issues Occurring In NBCU Profile?,news,1,0
Jeffrey Epstein investigation: Prince Andrew NOT cooperating,news,1,0
@rokambola : Post Edited: Llega la cebolla que no te hace llorar al cortarla http://bit.ly/37yiLlP,news,1,0
Chipotle fined $1.3M over thousands of child labor abuses,news,1,0
Democrat Majority For Israel are funding anti Bernie ADS in Iowa! This is a pro Israeli front group. Mark mellman leads the group.,news,1,0
Superfan Nicholson will miss Kobe ‘all the time’,news,1,0
The Most Common Exhaust System Problems,news,1,0
buy ios installs,news,1,0
Premiere Lumiere Photography,news,1,0
Illinois lawmaker bribery red light camera program,news,1,0
I’d like to think everyone can remember all the people that died in the crash...,news,1,0
Timnas Indonesia U-19 Kalah Dari Busan Ipark! Ini Kata Pelatih!,news,1,0
Chipotle hit with $1.3 million fine for thousands of child labor violations,news,1,0
"Dog attacks, kills 1-month-old in Lafayette",news,1,0
The coronavirus has sent a video game about wiping out humanity to #1,news,1,0
Ini Predikat SAKIP 2019 untuk Pemprov dan Kota-Kabupaten di Jatim,news,1,0
Helicopter Sikorsky crashes north of Los Angeles | Extreme Weather,news,1,0
@Afriupdate_com: Young guns shine as Arsenal move into FA Cup fifth round https://t.co/Ol0PQaiq4T https://t.co/eRKUR8liJq,news,1,0
What Does The Peacock Mean On 'Manifest'? It May Relate To The Death Date,news,1,0
"Ilford stabbings: Man, 29, charged with GBH",news,1,0
"Joe Luginbill of the Luginbill Children Foundation goes MIA, leaving organizations in the dark wondering whats next.",news,1,0
Chase Rice Slams Bachelor Producers After Former Flame and Peter Weber Came to Watch Him Perform,news,1,0
Spies like AI: The Future of Artificial Intelligence for the US Intelligence Community,news,1,0
Kobe Bryant: Pupil of Lucifer! part 2,news,1,0
Wuhan Wet Market. Origin of Corona Virus,news,1,0
Meghan Markle news: Father calls Duchess ‘preaching’ over global warming | Royal | News,news,1,0
Solapur Software Company,news,1,0
R.I.P Kobe Bryant,news,1,0
Norfolk Pine Tree Care California Grownup Tennis Junior Tennis Senior Tennis College Tennis Mixed Dual Tennis Tennis Camp Tennis In SoCal Adult League Tennis Juinor Organization Tennis Tennis For Kids Area Tennis Wheelchair Tennis Youth Tennis Flexible Tennis Southern California Neighborhood Tennis,news,1,0
TMZ scolded by police for breaking news of Kobe Bryant's death before family could be notified,news,1,0
Chase Rice Is ‘Really Pissed Off’ at ‘Bachelor’ Producers After His Former Fling’s Date at His Show,news,1,0
Death of Kobe Bryant: Pilot Was Trying to Fly Higher,news,1,0
"Terkini! Virus Corona Selimuti 4 Ribu Orang, 106 Tewas!",news,1,0
Mike Bloomberg's Healthcare Ad Is Misleading,news,1,0
"Government seeks Rs 8,000 crore more for Bhopal victims",news,1,0
More About PC Rentals’ Team,news,1,0
Surgical masks selling out across US amid fears over coronavirus,news,1,0
Caspian Airlines Flight 6936 Skids off the Runway Onto a City Road,news,1,0
