title,tag,score,y
I’m a Heterosexual Woman Who’s Politically Opposed to Heterosexuality,onion,1,1
Cruise Ship Erupts from Mt. St. Helen's After 8000 Mile Through Centre of Earth,onion,1,1
Is Our Wealth Hurting Africa's Feelings?,onion,1,1
Islam Is Incompatible With Country-Western Culture,onion,1,1
Xi Jinping Vows To Combat Coronavirus By Making It Illegal To Mention Within A Week,onion,1,1
Your Insides Are Like A Paper Bag Of Smashed Tomatoes - Dr. Good - Ep. 1,onion,1,1
"Heartwarming: When This Boy Came Out To His Parents, They Told Him They Couldn’t Care Less Who He Loves As Long As He Helps Them Clean Out The Fucking Garage",onion,1,1
Mike Pompeo: ‘There Is Overwhelming And Undeniable Evidence To Support Going To War With Whoever’,onion,1,1
Mexican beer rebrands as Ebola to avoid association with coronavirus,onion,1,1
CDC Urges Americans To Just Say No If Friend Offers Them Coronavirus,onion,1,1
"‘The Cowboy Thing Is Over,’ Says Lil Nas X Appearing On Red Carpet Dressed As 17th-Century Puritan Minister",onion,1,1
Treble Clef Honored With Lifetime Achievement Award During 62nd Annual Grammy Ceremony,onion,1,1
Victim In Fatal Accident Tragically Not Glenn Beck,onion,1,1
business is no more,onion,1,1
Liberals Say Sanders’s Acceptance Of Rogan Endorsement Sends Dangerous Message He Trying To Win Election,onion,1,1
Local Man Arrested After Blaring “Benny Hill” Song Near People Slipping On Ice,onion,1,1
Onion Explains: Global Nuclear Proliferation​,onion,1,1
Trump Makes Powerful Pro-Life Case By Speaking About The Joys Of Neglecting A Child,onion,1,1
Melting Giraffe Congressman Warns Impeachment Distracting From Surreal Issues,onion,1,1
6 Creatures Of Myth And Folklore That Are Squatting In My Garage Ranked By How Much Of Hassle They’re Being,onion,1,1
Weinstein Defense Attorney Implores Jury To Remember How Fun ‘Pulp Fiction’ Is,onion,1,1
Hot Hot Hollywood: Glenn Close Is Exiting The Chateau Marmont With Richard Linklater And The Crypt Keeper On Each Arm And They Are Smugly Walking Into The Traffic Of Sunset Boulevard To Kill Themselves,onion,1,1
Eli Manning Retires From NFL To Focus On Being Statistically Average Father,onion,1,1
Trump Lifts Obama-Era Protections Trapping Gangthor The Malevolent In Tomb Deep Within Murky Depths Of Pacific Ocean,onion,1,1
‘Kingdom Hearts III’ DLC Developers Panicking After Realizing ‘Shrek’ Not Owned By Disney,onion,1,1
Fascinating Trend: More And More Women Are Freezing Their Kids Until They’re Ready To Raise Them,onion,1,1
Financial Experts Recommend Just Waiting Until Chaos Is Law Of The Land,onion,1,1
PornHub Announces Contest To Allow One User Under 18 To View Content,onion,1,1
Justice Roberts Sternly Admonishes Impeachment Participants To Remember They’re At Complete Farce Of A Trial,onion,1,1
Impatient Man Forced To Wait To Have Sex Until Wife Finished Giving Birth,onion,1,1
Latest discovery in fossils.,onion,1,1
Trapping Small Game And More: 11 New Uses I Discovered For My Ass While Living As A Hermit In The Woods The Past 20 Years,onion,1,1
Still ahead of this hour...,onion,1,1
Balls To The Wall: This Incredibly Graphic Bus Stop PSA Isn’t Even Trying To Use A Euphemism To Describe Breast Self-Exams,onion,1,1
Area Dad Sure Knows A Lot About Local Weather Woman,onion,1,1
Kellyanne Conway Suggests Martin Luther King Jr. Would Have Traveled To Ukraine For Dirt On Biden,onion,1,1
Contrarian ‘New York Times’ Travel Section Breaks With Paper To Endorse Deval Patrick For Democratic Nomination,onion,1,1
"7 Off-The-Dome, Probably Unhelpful Ideas To Reform The Prison System Just To Get The Ball Rolling",onion,1,1
"Deal Alert: This 4-Year-Old Wandered Really Far From The Playground, Your Car’s Right There, And Her Parents Would Definitely Cough Up Enough For A Marvel 3-In-1 Arcade Machine To Get Her Back",onion,1,1
Going Rogue: ‘The New Yorker’ Has Announced That They’re Going To Start Putting An Umlaut Over Every Letter ‘O’ And No One Can Stop Them,onion,1,1
Real-Life ‘Katamari!’ This Drunk Driver Is Still Dragging The Cyclist He Hit,onion,1,1
Top 6 Happiest Countries In The World,onion,1,1
Onion is aux what he gonna play doe,onion,1,1
American Airlines To Phase Out Complimentary Cabin Pressurization,onion,1,1
Members Of Academy Can't Imagine What Would Happen If They Ever Selected Wrong Best Picture,onion,1,1
"‘They Can’t Impeach Someone They Can’t See,’ Say Trump Boys Cramming Dad Into Homemade Bunker Under Oval Office Desk",onion,1,1
Businessman Does His Work Lying On Bed Like Schoolgirl,onion,1,1
Unclear What Licensing Deal Led To Single Season 4 Episode Of ‘The Blacklist’ Being Available For Viewing On Airplane,onion,1,1
An Inequitable System: 90% Of People Appointed Car DJ Are Only Given The Job Because They’re Sitting Shotgun,onion,1,1
5 Times He Come In Looking All Huge With His Jiggling Face And Spraying His STINK And Mess Around With Our Jewels And Our Snacks 5 TIMES HE DID THIS TO US With His Stink And Spraying His Fluids Onto The TV When We're Trying To Watch Commercials 5 Times,onion,1,1
Body Positivity Win: This Thing Seems Overweight For Whatever The Hell It Is But It’s Still Beautiful,onion,1,1
A dentist was filmed extracting a tooth while on a hoverboard.,onion,1,1
Conservatives: Sex Change Only Barrier Between Gays/Marriage,onion,1,1
Someone check his GSP,onion,1,1
Report: Economy Failing Because U.S. Built On Ancient Indian Burial Grounds,onion,1,1
Chrysler Halts Production Of Neckbelts,onion,1,1
CNN Audio Analysis Reveals Biden Caught On Wet Mic While Chewing On Own Microphone,onion,1,1
"Man Assumed Being Heartless, Egotistical Maniac Would Have Made Him Richer By Now",onion,1,1
"Lapsed Amish Should Feel Free To Ease Themselves Into The Internet’s Vast Wealth Of Content With This List Of 5 Simple, Easy-To-Grasp GIFs",onion,1,1
Underwear-Clad Senators Line Up Before Congressional Doctor To Make Sure They Physically Fit For Impeachment,onion,1,1
NCAA Determines Becoming A Bengal Punishment Enough For Joe Burrow Taking Cash From Odell Beckham,onion,1,1
Republican Senators Maintain They’ll Weigh All Evidence Before Carrying Trump Out On Shoulders,onion,1,1
Impressive ‘Super Smash Brothers’ Purist Only Plays Original SNES Or NES Game Each Character From,onion,1,1
Russian Olympic Program Denies Steroids Played Role In 8-Year-Old Gymnast Hurling Balance Beam Through Wall To Escape,onion,1,1
"Trekkies Bash New Star Trek Film As 'Fun, Watchable'",onion,1,1
Trevor Noah adds to the controversy of the Royal family’s racial discrimination: Live on air,onion,1,1
The Onion Presents The Topical,onion,1,1
CNN Reveals Bernie Sanders Running For President Of Country With History Of Sexism,onion,1,1
The Onion Presents The Topical,onion,1,1
The Onion Presents The Topical,onion,1,1
Stephen Miller Hurt At Being Passed Over For Job Stalking Female Ambassador,onion,1,1
Incredibly Tragic: Everyone At This Trivia Table Wrongly Assumes At Least One Of Their Friends Is Still Having Fun,onion,1,1
"Jeff Bezos Donates $690,000 Directly Into Australian Fire",onion,1,1
What Was He Going For? Dr. Phil Wore A Fat Suit On Yesterday’s Episode Of His Show But Just Sat There Without Addressing Any Body Positivity Stuff,onion,1,1
But he caught the pikachu,onion,1,1
Human Trafficker Not Getting Any Traction On This One,onion,1,1
Royal Thieves: Queen Elizabeth Says That Harry And Meghan Took All 50 Sets Of Her Dentures With Them When They Left Buckingham Palace,onion,1,1
"Man requests sword fight with ex-wife and lawyer to settle legal dispute - David Ostrom, 40, of Paola, Kansas asks judge for trial by combat in 12 weeks, so he has time to secure Japanese samurai swords",onion,1,1
Morbid Visit Home Begins With Grandfather Only Able To Complete Single Flying Crane Backflip Kick To Ward Off Intruders,onion,1,1
Public Disapproval Of Iran Approach Convinces Trump To Reverse Soleimani Killing,onion,1,1
"Major Disappointment: J.J. Abrams Has Revealed That Finn And Poe Are Both Gay, But Don’t Really Vibe With Each Other Romantically",onion,1,1
Pete Buttigieg Trapped In Freezer After Searching Iowa Diner For Back Room With High-Rolling Donors,onion,1,1
Stouffers To Include Suicide Prevention Tips On Single Serve Microwavable Meals,onion,1,1
CNN Reminds Debate Participants To Keep Personal Attacks Off The Stage In Favor Of New Confession Cam Backstage,onion,1,1
CNN Moderator Challenges Sanders’ Support For Women By Asking Him To Name Every Part Of Female Reproductive System,onion,1,1
Sanders Campaign Doubles Down With New Ad Warning Americans They’ll Never Be Able To Hear A Female President Over The Sound Of Her Vacuum,onion,1,1
Incredibly Frustrating: A Watermark Has Appeared Over Mt. Rushmore,onion,1,1
Increasingly Unwell Harvey Weinstein Arrives To Court As Jar Of Ashes,onion,1,1
"God, We’re So Lonely: 5 Angela And Andy Moments That We’d Take As Couple Goals At This Point",onion,1,1
Swing Voter Really Relates To Buttigieg’s Complete Lack Of Conviction,onion,1,1
Cory Booker Drops Out Of 2020 Rat Race After Falling In Love With Small-Town Iowa Life,onion,1,1
Landlord Figures He Can Pass Off Uninhabitable Shithole As ‘Great For Students’,onion,1,1
"Homeless, Disheveled Prince Harry Spotted Eating Out Of Garbage Can Just 24 Hours After Stepping Away From Monarchy",onion,1,1
"'I Can’t Believe I’m Inside His Asshole’: This Doctor Is Giving Bruce Springsteen His Annual Prostate Exam Right Now And Trying To Play It Cool, But, C’mon, It’s The Boss!",onion,1,1
Diet Book Author Advocates New 'No Food Diet',onion,1,1
Human-Resources Bitches Be Makin' Me Take Vacation Days,onion,1,1
My son Jared told me to post this here. I hope it brings warm feelings from the cellars of your loins!,onion,1,1
Census Visits Providing Shut-Ins Once-A-Decade Chance For Human Interaction,onion,1,1
I Hope My Baby Doesn't Come Out All Fucked-Up And Shit,onion,1,1
Secret Service Shuts Down Biden’s Unofficial White House Tour Operation,onion,1,1
Narrow Gaps In Bathroom Stall Doors To Be Widened Monday,onion,1,1
Study: Majority Of Children Lack Strong Male Supermodels,onion,1,1
Study Finds Suspicious Circumstances Still Leading Cause Of Death In Russia,onion,1,1
Saudi authorities close down shop selling traditional camel urine drinks… after discovering the owner had been filling the bottles with his own bodily waste,onion,1,1
Hasbro Launches Line Of Trap-Building Kits To Encourage Girls To Get Into Post-Apocalyptic Survivalism,onion,1,1
Emergency Last Responders Loiter Around Scene Pretending To Aid Victims After Most Of The Work Already Done,onion,1,1
New Program Provides Depressed Americans With Suicide Assistance Dogs,onion,1,1
U.S. Plagued By Widespread Website Crashes After Mouse Gets Into Internet,onion,1,1
Fatal Staples Center Collapse Brings Merciful Early End To Clippers Game,onion,1,1
Zoo Visitors Impressed By Number Of Animals Willing To Eat Change,onion,1,1
Life At A Website: ClickHole's Daily Routine,onion,1,1
Heartbreaking: This Guy Has No Idea That He’s So Strange And Memorable-Looking That Everyone From His Flight Is Using Him As A Landmark To Figure Out Which Baggage Claim Area Is Theirs,onion,1,1
Media Company Lays Off Dozens Of Unskilled Bloggers,onion,1,1
"Making A Difference: For Every Hot Dog This Restaurant Sells, They Donate A Pair Of Glasses To A Hot Dog In Need",onion,1,1
Man Validated After Discovering Popular Kid From High School Ended Up Bottoming Out Almost As Much As He Did,onion,1,1
Chinese Government Justifies Mass Surveillance By Explaining That All Of Life A Grand Performance,onion,1,1
"An oldie, but a goodie",onion,1,1
Man Validated After Discovering Popular Kid From High School Ended Up Bottoming Out Almost As Much As He Did,onion,1,1
"Meh: This Woman Shared ‘Real’ Photos Of Her Post-Pregnancy Body To Start A Conversation About Imperfections, But We’ve Already Seen That A Bunch Of Times",onion,1,1
Excited Park Rangers Announce Lincoln Memorial Actually A Girl After Statue Gives Birth To Litter Of Tiny Marble Abraham Lincolns,onion,1,1
Dumb Tourists In Paris Gawking At Splendor Of Greatest Architectural Feats In Human History,onion,1,1
Couple No Fun Anymore After Having Kids Die,onion,1,1
Absolutely Heartwarming: This Stray Dog Was Living Sick And Abandoned Until This Incredible Family Took Her In And Regularly Put Rectal Suppositories Into Her Asshole To Relieve Her Chronic Constipation And Had Her Foul Anal Glands Expressed On A Weekly Basis Until She Was Healthy Again!,onion,1,1
"Arby's Now Charging $2.99 To Let Customers Go Behind Counter, Grab Handfuls Of Roast Beef",onion,1,1
"NRA Sets 1,000 Killed In School Shooting As Amount It Would Take For Them To Reconsider Much Of Anything",onion,1,1
Landmark Supreme Court Decision Lets Americans Cram Cash Directly Into Politicians' Mouths,onion,1,1
A Timeline Of U.S.–Iran Relations,onion,1,1
Man With Nice Eyes Blown,onion,1,1
Body-Positive Male Ally Worried Girlfriend Has Been Packing On The Beauty Lately,onion,1,1
Modern Video Games Are Giving Kids Unrealistic Standards For How Many Swords They Can Carry At One Time,onion,1,1
Truffle Oil Embarrassed To Be Working With Low-Class Ingredients On Loaded Fries,onion,1,1
Zoo Visitors Impressed By Number Of Animals Willing To Eat Change,onion,1,1
Hasbro Launches Line Of Trap-Building Kits To Encourage Girls To Get Into Post-Apocalyptic Survivalism,onion,1,1
So Sexy! These 6 Frogs Don’t Even Have To Be Princes In Disguise To Get A Little Tongue Action From Us,onion,1,1
"In The Know Panel Analyzes Obama's Furious, Profanity-Filled Rant At Nation",onion,1,1
"Girl, 9, disappears using cream that makes you ten years younger",onion,1,1
Fucking Idiot Has Perfect GIF For That,onion,1,1
Report: Growing Ranks Of Nouveau Poor Facing Discrimination From Old Poor,onion,1,1
Nation Refuses To Read Headline Beyond Words '4-Year-Old Girl Forced To',onion,1,1
Report: Everything Slightly Worse Than Yesterday,onion,1,1
"Cat Treat Package Going On About Delicious, Creamy Center Too Much Not To Be Marketing To Humans",onion,1,1
"Fascinating: Historians Have Determined That If Mozart Had Lived 15 Seconds Longer, He Might Have Produced Up To Two More Nice Loud Piano Sounds",onion,1,1
A State Of Flow: Jimmy Buffett Has Been Up For 5 Straight Days Composing A Symphony About A Sangria Señorita,onion,1,1
5 Things To Know About ‘Cats’,onion,1,1
Should The Government Stop Dumping Money Into A Giant Hole?,onion,1,1
Grow Up Guys: These Immature 6th-Grade Boys Start Laughing Every Time Their Sex Ed Teacher Talks About A Man’s Pempler Going In A Woman’s Vooguss,onion,1,1
Barbara Bush Runs Aground Off Coast Of Maine,onion,1,1
Newsroom : Congress Announces Plan To Hide Nation's Porn From Future Generations,onion,1,1
Grow Up Guys: These Immature 6th-Grade Boys Start Laughing Every Time Their Sex Ed Teacher Talks About A Man’s Pempler Going In A Woman’s Vooguss,onion,1,1
Our Annual Year: Best Of Entertainment,onion,1,1
Bush Regales Dinner Guests With Impromptu Oratory On Virgil's Minor Works [oldie but goodie. simpler times...],onion,1,1
Me own paw ate it,onion,1,1
Dogs And Cats Who Were Certain You’d Be The One To Adopt Them In 2019,onion,1,1
New laws now deem practicing with an electronic device illegal,onion,1,1
"You're 'posed to hold me down, but you're holding me back",onion,1,1
Vatican Dispatches Elite Team Of Bishops To Sabotage Contraceptive Manufacturer,onion,214,1
All Of Nation's Resources Dumped Into 50 Children Who Are Actually The Future,onion,3,1
Genetic Scientists Develop Sheep With Goat Brain,onion,5,1
Newsroom : 80 Percent Of Roommates Got So Drunk Last Night,onion,30,1
Navy Admiral Considers Death Of Son Within Acceptable Loss Range,onion,12,1
Gay Marine Beaten To Bloody Pulp To Fire Up RNC Crowd,onion,707,1
Embarrassing Bounced Check From Greece Taped Up In IMF Headquarters,onion,2,1
Sloths on the run,onion,1,1
Blockbuster Offers Glimpse Of Movie Renting Past,onion,8,1
"do somebody know if hidden market is legit or have any kind of buying experience with them because I think I,ve been scam",onion,1,1
Soldier Excited To Take Over Father’s Old Afghanistan Patrol Route,onion,1501,1
Can You Hapless Fuckwits At Least Handle An Omelette?,onion,17,1
This War Will Destabilize The Entire Mideast Region And Set Off A Global Shockwave Of Anti-Americanism vs. No It Won’t,onion,28,1
Concentric Circles Emanating From Glowing Red Dot,onion,2,1
US Schools Trail World In Child Soldier Aptitude,onion,559,1
Is Your Flamingo Sick Enough To Make A Movie About?,onion,1,1
It happened,onion,1,1
More American Workers Outsourcing Own Jobs Overseas,onion,1,1
‘So People Could Be Listening To This Conversation Right Now?’ Asks Joe Rogan Trying To Understand Edward Snowden’s Explanation Of Surveillance,onion,1,1
Destroyed substitute teachers,onion,1,1
Keep those kids safe!,onion,1,1
Is The Government Spying On Schizophrenics Enough?,onion,1,1
Dogs And Cats Who Were Certain You’d Be The One To Adopt Them In 2019,onion,1,1
Zac Efron flown to Australia hospital from Papa New Guinea after being nearly killed during the filming of his new series ‘Killing Zac Efron’,onion,1,1
Bored Scientists Now Just Sticking Random Things Into Large Hadron Collider,onion,1,1
Mattel Preempts Backlash Over Gender-Neutral Doll With Release Of New ‘Covered In Genitals’ Barbie,onion,1,1
"I was watching an older video, when...",onion,1,1
Plight Of Missing Hikers Will Make Great Movie,onion,1,1
"BREAKING: Walmart to employ 10,000 ghosts by the end of 2020.",onion,1,1
Found this hidden gem/never before seen onion video,onion,1,1
DNA Evidence Frees Black Man Convicted Of Bear Attack,onion,1,1
Anonymous Philanthropist Donates 200 Human Kidneys To Hospital,onion,1,1
Saudi crown prince defends China's right to put Uighur Muslims in concentration camps,onion,1,1
Open Relationship Gives Couple Freedom To Emotionally Drain Other People From Time To Time,onion,1,1
Devastated Family Struggling To Get Through First Christmas Since Dad Returned,onion,1,1
Sitcom Characters Still In Shock After Christmas Episode Proves Existence Of Santa Claus,onion,1,1
"Ho, Ho, Ho! I Saw You Masturbating! (By Santa Claus)",onion,1,1
German Leaders Quietly Confident They Could Pull Off Another Holocaust If They Ever Really Wanted,onion,1,1
Pilot Tells Passengers He’s About To Try Something,onion,1,1
China Launches First Willing Manned Mission Into Space,onion,1,1
27-Year-Old Lies About Every Single Aspect Of His Life To Keep Parents From Worrying,onion,1,1
it actually might work,onion,1,1
Trump rails against windmills: 'I never understood wind',onion,1,1
Quit Whining And Put On A Goddamn Coat: My Journey - Onion Talks - Ep. 8,onion,1,1
"Antsy, Jonesing Nation Demands New Grinch Content",onion,1,1
"Poll Reveals GOP Nomination Now Two-Way Race Between Mitt Romney, Total Voter Apathy",onion,1,1
"Police Unimpressed With Rooftop Sniper - ‘It’s Been Done,’ Say Officials",onion,1,1
De Blasio gets caught selling our schoolchildren yet again,onion,1,1
Tips For Displaying Artwork In Your Home,onion,1,1
They missed 1,onion,1,1
Caroler Who Forgot Lyrics Getting Pretty Far Just Saying ‘Bell’ Every Few Seconds,onion,1,1
Increase Your Cognitive Ability By Reading A Fucking Book For Once,onion,1,1
How To Find The Best Cheap Eats In The Dumpsters Behind Los Angeles's Best Restaurants,onion,1,1
"Deal Alert: Got A Nintendo Switch And Amazon Prime? Well, Look At You, Mr. Moneybags",onion,1,1
Disney Capitalizes On Success Of Baby Yoda With Baby Jar Jar,onion,1,1
Prominent Evangelical Magazine Calls For Removing Trump From Holy Trinity,onion,1,1
Report: Make It Stop,onion,1,1
FCC Chief Cites Special Occasion For Allowing Vaginal Penetration On Network Sitcom,onion,1,1
Man In Mickey Mouse Suit Obviously Attempted To Eat Ribs,onion,1,1
Ronald Reagan Endorses 'Pill Lady' for president,onion,1,1
Weak Little Man Asks For Help,onion,1,1
"The Stories In ‘The Flintstones’ Are Powerful, But They Probably Didn’t Literally Happen",onion,1,1
Zombie Reagan Raised From Grave To Lead GOP,onion,1,1
"Republicans Stalling Obama's Agenda By Speaking, Moving In Slow Motion",onion,1,1
CG Supervisor For ‘Cats’ Thought He Actually Did An Okay Job,onion,1,1
DNC Eases Debate Requirements To 0.1% Above Whatever Cory Booker Polling,onion,1,1
Trump comments on new reddit coin system. “ sorry to all the losers and haters who can’t afford coins. Don’t be sad you’re boring”,onion,1,1
DNC Eases Debate Requirements To 0.1% Above Whatever Cory Booker Polling,onion,1,1
"Dry Humping An Adequate Sex Alternative For Teens, Says Weird, Unsolicited Report From Department Of Interior",onion,1,1
Supreme Court Overturns 'Right v. Wrong',onion,1,1
Sad ‘Rise Of Skywalker’ Fan Can’t Believe There Never Going To Be Another ‘Star Wars’ Movie,onion,1,1
CG Supervisor For ‘Cats’ Thought He Actually Did An Okay Job,onion,1,1
Fair And Balanced: 4 Ways In Which SpongeBob Is Sponge Goals And 4 Ways In Which He Is Not,onion,1,1
Middling ‘Rise Of Skywalker’ Review Leaves Fan On Fence About Whether To Threaten To Kill Critic,onion,1,1
The Power Of Selling Out: Your Customers As Political Capital - Onion Talks - Ep. 9,onion,1,1
‘United 93’ Director Announces Remastered Edition Digitally Removing WTC From Film,onion,1,1
What Is The Biggest Rock? - Onion Talks - Ep. 4,onion,1,1
GOP Turns Dozens Of House Democrats Away From Impeachment For Failing To Provide Adequate Voter ID,onion,1,1
"Reporters Blow Up Plane, Expose Security Lapses",onion,1,1
Insurance Company Annoyed Customer Doesn’t Realize They Were Just Being Polite When They Said They’d Cover Healthcare Bills,onion,1,1
“No one knows the loopholes like I do”,onion,1,1
GOP Turns Dozens Of House Democrats Away From Impeachment For Failing To Provide Adequate Voter ID,onion,1,1
"If The Founding Fathers Were Alive Today, They’d Be Too Fascinated By A Garbage Disposal To Do Anything",onion,1,1
Going-Out-Of-Business Sign Thanks Neighborhood For 3 Months Of No Support Whatsoever,onion,1,1
"Man Just Going To Grab Guitar And Old Four-Track, Go Out To Cabin In Woods, Make Shittiest Album Anyone's Ever Heard",onion,1,1
Congressman Could’ve Sworn Last Impeachment Was Catered,onion,1,1
Laid-Back Voices Urging Man To Kill His Family When He Gets A Chance,onion,1,1
Police Find Adorable Little Skeleton,onion,1,1
Poll Finds 54% Of Americans Approve Executing Trump But Leaving Him In Office,onion,1,1
Adam Driver Storms Out Of Grand Canyon National Park After It Rudely Echoes His Voice Back To Him,onion,1,1
Grow Up Guys: These Immature 6th-Grade Boys Start Laughing Every Time Their Sex Ed Teacher Talks About A Man’s Pempler Going In A Woman’s Vooguss,onion,1,1
‘United 93’ Director Announces Remastered Edition Digitally Removing WTC From Film,onion,1,1
Congress Reaches $1.4 Trillion Spending Deal To Award Entire Budget To One Lucky American,onion,1,1
"Missing Teen's Friends Go On TV To Plead For Her Release, Gossip About Ugly Classmates 🧅",onion,1,1
'How Bad For The Environment Can Throwing Away One Plastic Bottle Be?' 30 Million People Wonder,onion,1,1
Study Finds Youths Don't Follow Office Politics,onion,1,1
"Making A Difference: For Every Hot Dog This Restaurant Sells, They Donate A Pair Of Glasses To A Hot Dog In Need",onion,1,1
Boeing Rebrands 737 Max With Flame Decals To Attract Risk-Taking Badasses With A Death Wish,onion,1,1
Our Dumb Decade: Best Of 2010,onion,1,1
Luddite In 2070 Refuses To Merge Consciousness With Self-Driving Hyundai Elantra,onion,1,1
Writers Retreat Gives Aspiring Novelists Opportunity To Receive Critical Feedback From Other Nobodies,onion,1,1
A Life Unfinished: Stephen Hawking’s Estate Just Revealed The Genius Astrophysicist Died With Only 91% Completion For ‘The Witcher 3’,onion,1,1
Facebook To Allow Changes To Privacy Settings If Users Guess Word In Locket Worn By Mark Zuckerberg,onion,1,1
Clint Eastwood Propositions Film Critic To Obtain More Positive Review Of ‘Richard Jewell’,onion,1,1
New Artist Spotlight: ClickHole Invites You To Check Out The Funky Summer Tunes Of Boston Indie Rockers Guster!,onion,1,1
‘And Then Those 12 People Send It To 12 People—That’s 144 People!” Says Cory Booker Describing Campaign Newsletter Strategy To Rosario Dawson,onion,1,1
Harvey Weinstein Laments Being Treated Like He Didn’t Put Whole #MeToo Movement On The Map,onion,1,1
Dalai Lama Announces Before Reincarnating His Spirit Will Probably Fly To Moon And Hang Out For A Bit,onion,1,1
Fox News Condemns 2020 Election As Partisan Witch Hunt Orchestrated By Democrats To Unseat President,onion,1,1
Ex-Pedophile Shares Tips On How To Make Your Kids Less Attractive,onion,1,1
Expert Wasted Entire Life Studying Anteaters,onion,1,1
Thousands Of Girls Match Description Of Missing Sorority Sister,onion,1,1
Victim In Fatal Car Accident Tragically Not Glenn Beck,onion,1,1
Grizzly Bear Catches Spawning Michael Phelps In Jaws,onion,1,1
Hungover Coworker A Little Too Functional Morning After Holiday Party Not To Be Alcoholic,onion,1,1
"Captain Actual America Overweight, Hopelessly In Debt",onion,1,1
Man Relaxing His Overwhelming Anxiety For Just A Moment Finally Gives Pack Of Coyotes The Opening They Need,onion,1,1
Cubs Sign Sammy Sosa To $300 Million Deal Just To Give Casual Fans Point Of Reference,onion,1,1
Woman Not As Fun-Loving And Carefree As Pom-Pom On Winter Hat Would Suggest,onion,1,1
Patriots Claim Unsanctioned Recording Was Only For Project Julian Edelman Working On For Filmmaking Class,onion,1,1
A State Of Flow: Jimmy Buffett Has Been Up For 5 Straight Days Composing A Symphony About A Sangria Señorita,onion,1,1
Beyond The Obvious: 6 Other Social Networks Besides Trainfuckers You’ve Gotta Join If You’re Sexually Attracted To Trains,onion,1,1
Tokyo Drivers Gridlocked As 12-Legged Catbus Overturns On Highway,onion,1,1
