title,tag,score,y
"Amid coronavirus fears, sales rise for Plague Inc., a game about deadly pathogens",not onion,1,0
BART Withholding Surveillance Videos Of Crime To Avoid ‘Stereotypes’,not onion,1,0
"Man convicted in 2006 of killing wife with hammer, gets out on parole and kills again",not onion,1,0
"Fidget spinners, note taking, pacing: staying awake in the Senate chamber",not onion,1,0
"3 teens killed after game of ding-dong-ditch turns deadly, victim's mother says",not onion,1,0
Burglar says Trump is her CIA Handler and the Clinton's are her parents.,not onion,1,0
Buy Forum Posting,not onion,1,0
An Arizona driver thought his skeleton passenger meant he could drive in the HOV lane. He was wrong,not onion,1,0
"In 2019, more Americans went to the library than to the movies. Yes, really.",not onion,1,0
Ha ha,not onion,1,0
Man Registers Emotional Support Beer,not onion,1,0
Beer Nut: Man attempts to register beer as a support animal,not onion,1,0
"Enough with the pooping and peeing, says downtown Seattle business",not onion,1,0
"Disease simulator creator reminds players that Plague Inc. ""is a game, not a scientific model""",not onion,1,0
‘Sorry about the tasty bat’: Chinese online host apologises for travel show dining advice as Wuhan virus spreads,not onion,1,0
Jersey expected to scrap 'only husbands talk tax' rule,not onion,1,0
Jersey expected to scrap 'only husbands talk tax' rule Under current legislation women can discuss tax affairs with government only after husbands’ permission,not onion,1,0
Chinese city uses surveillance tech to shame citizens for wearing pajamas outside,not onion,1,0
Arizona Sheriff Uses A Tank And Steven Seagal To Arrest Cockfighting Suspect,not onion,1,0
Wyoming governor's pitch: Fight climate change with coal,not onion,1,0
"An Indiana teenager is being honored after a distressed parent left a newborn child in a baby drop-off box he raised $10,000 to install",not onion,1,0
Taiwan fines coronavirus patient $10000 for 'hiding' illness,not onion,1,0
Meet the Woman Bringing Social Justice to Astrology,not onion,1,0
Meet the Woman Bringing Social Justice to Astrology,not onion,1,0
Woman dies after choking in lamington-eating competition on Australia Day,not onion,1,0
Spider bites Australian man on penis again.,not onion,1,0
Natick police catch alleged serial defecator relieving herself in business’s lot,not onion,1,0
"Gold-seated toilet among items up for auction from Frank Sinatra's ""Chairman Suite"" in New Jersey",not onion,1,0
Sales for the video game 'A Plague's Tale' spikes after Coronavirus outbreak,not onion,1,0
Woman dies during Australia Day lamington-eating competition,not onion,1,0
Car with hidden drugs sold at police auction,not onion,1,0
"France is losing the battle to save the baguette, warns leading bread historian",not onion,1,0
Patch infused with smell of bacon developed 'to help vegetarians and vegans with meat cravings',not onion,1,0
"6 Decades Later, This Atomic Vet Is Finishing His Music Education",not onion,1,0
A Meat Patch,not onion,1,0
Chicken Kills Man With Blade During Cockfight,not onion,1,0
Man launches GoFundMe page to ‘protect Betty White from 2016’,not onion,1,0
Florida man turns $500K home into technicolor nightmare,not onion,1,0
Disgusting moment Chinese man dips still wriggling baby mice in sauce before eating them alive,not onion,1,0
Disgusting video of man eating newborn mouse with a pair of chopsticks,not onion,1,0
Marijuana sales along Oregon/Idaho state line are 420% higher than Oregon average,not onion,1,0
Some truth,not onion,1,0
Florida man turn’s house into a color explosion.,not onion,1,0
Florida man turns house into an explosion of colors.,not onion,1,0
Man takes skeleton passenger to use car-share lane,not onion,1,0
"A Florida man was arrested for shining a laser pointer at planes, temporarily blinding a pilot, police say",not onion,1,0
Man 'charges at police with hammer after being caught shining lasers at planes' One pilot was left with temporary blindness and lingering blurred vision,not onion,1,0
Vermont Lawmaker's Bill Would Allow Emoji on License Plates,not onion,1,0
"Hasbro, Inc. known for games like Monopoly and Operation, now owns west coast hip hop label Death Row Records",not onion,1,0
Chinese University of Minnesota Student Jailed for Anti-Xi Tweets Has Been Released to Wuhan,not onion,1,0
A man diagnosed with Wuhan coronavirus near Seattle is being treated largely by a robot,not onion,1,0
"Man deposits $980,000 check from IRS, lands prison sentence",not onion,1,0
Chinese University of Minnesota Student Jailed for Anti-Xi Tweets Has Been Released to Wuhan,not onion,1,0
3 year old and 16 year old shot by police during search.,not onion,1,0
Elizabeth Taylor arrives late for her own funeral,not onion,1,0
Florida man turns $500K home into technicolor nightmare,not onion,1,0
Florida man turns $500K home into technicolor nightmare,not onion,1,0
'Penis Man' Graffiti Artist Arrested by '25 Heavily Armed SWAT Officers',not onion,1,0
Man cited for using fake skeleton to drive in HOV lane,not onion,1,0
Crazy smash and grab robbery at london jewellers,not onion,1,0
Federal court: Getting muted in RuneScape doesn’t violate your civil rights,not onion,1,0
"Kentucky sheriff finds missing girl, 17, after psychics tell him he would",not onion,1,0
A black man in Michigan tried to deposit checks at his bank. The manager called police.,not onion,1,0
Environmental Concerns: Al Shabaab Terrorists Ban Single Use Plastics,not onion,1,0
Al Shabaab terror group bans single-use plastic bags,not onion,1,0
In sign of coming apocalypse: Al Shabaab terror group bans single-use plastic bags | World News,not onion,1,0
Man cited for using fake skeleton to drive in HOV lane,not onion,1,0
Study finds thatPeople Care More about Dogs Than Humans,not onion,1,0
Hospital staff in Wuhan are wearing adult diapers because they don't have time to pee while caring for an overwhelming number of coronavirus patients,not onion,1,0
Man cited for using fake skeleton to drive in HOV lane,not onion,1,0
Saddam Hussein wrote a romantic novel you can buy on Amazon,not onion,1,0
House impeachment manager quotes Notorious B.I.G. on the Senate floor,not onion,1,0
"Florida man in Easter Bunny costume arrested after hit-and-run, previously seen in viral video brawling in same outfit",not onion,1,0
In recording Trump asks how long Ukraine can resist Russians,not onion,1,0
Rolls-Royce is reportedly building mini nuclear reactors,not onion,1,0
A black man in Michigan tried to deposit checks at his bank. The manager called the police.,not onion,1,0
The Video of Donald Trump Telling Associates to “Get Rid of” Ambassador Marie Yovanovitch Has Been Released,not onion,1,0
Federal court: Getting muted in RuneScape doesn’t violate your civil rights,not onion,1,0
Devoted football fans experience 'dangerous' levels of stress,not onion,1,0
How Tinder saved a woman’s life while stranded in wilderness,not onion,1,0
Dems Can't Take the Chance of Voters Deciding 2020 Election | RealClearPolitics,not onion,1,0
Federal court: Getting on muted on Runescape does not violate your civil rights,not onion,1,0
"Donald Trump Defense Team Argues That Impeachment Process, Set out in Constitution, is Unconstitutional",not onion,1,0
Man slashes tires of 160 cars after deadly earthquake,not onion,1,0
UFOs could be time-travelling humans from the future - professor,not onion,1,0
Florida man deposits 980k refund check from the IRS while only claiming 18k in wages,not onion,1,0
China Is Publicly Shaming Pajama Wearers By Using Facial Recognition,not onion,1,0
"Newborn dies as eunuchs snatch him from mother and dance, demanding cash",not onion,1,0
Federal court: Getting muted in RuneScape doesn’t violate your civil rights,not onion,1,0
"Kentucky sheriff finds missing girl, 17, after psychics tell him he would",not onion,1,0
The Hill: Is Donald Trump One Of The Smartest Presidents In US History?,not onion,1,0
Al Shabaab terror group bans single-use plastic bags | World News,not onion,1,0
'You're too big': Airline gets out tape measure ahead of family's flight,not onion,1,0
Your civil rights weren't violated when you were muted out of a video game US court teslls angry gamer.,not onion,1,0
"Donald Trump Defense Team Argues That Impeachment Process, Set out in Constitution, is Unconstitutional",not onion,1,0
'Things you cannot make up': Marijuana sales on Idaho-Oregon border are 420% above average,not onion,1,0
Sen. Pat Toomey put in charge of ‘candy desk’ during President Trump’s impeachment trial,not onion,1,0
Men's rights activist honoured for service to gender equity,not onion,1,0
Racist Cop Who Called Tamir Rice a ‘Thug’ Now Identifies as a Black Man—Seriously,not onion,1,0
Arizona man dresses up fake skeleton to drive in HOV lane,not onion,1,0
"""Oregon sales per adult along the Idaho border are 420% the statewide average.""",not onion,1,0
Trump’s new school lunches guidelines say pasta is a vegetable and potatoes are fruit,not onion,1,0
Did Gritty punch a 13-year-old boy in the back? Philadelphia detectives are investigating.,not onion,1,0
Pigeons identify breast cancer 'as well as humans',not onion,1,0
420%,not onion,1,0
Doctors beg men not to masturbate with banana peels,not onion,1,0
Al Shabaab terror group bans single-use plastic bags,not onion,1,0
"Man plugs PS4 into airport monitor to play Apex Legends, is politely told to leave",not onion,1,0
"That’s a really immature joke. I’m not laughing at that, I just thought of something else funny",not onion,1,0
Being Fat In The Workplace Is Hard. Standing Up For Yourself Is Harder.,not onion,1,0
Secondo questo articolo Credem accetta forme di Parmigiano come tutela sui prestiti,not onion,1,0
Man says bank racially discriminated when they refused to cash checks from discrimination settlement,not onion,1,0
Checkmate atheists! Their religion might die out.,not onion,1,0
Man dies after being attacked by his rooster on their way to cockfight,not onion,1,0
Al-shabaab terror group bans single use plastic bags.,not onion,1,0
"Being ‘muted’ in a game does not violate your civil rights, US federal court declares.",not onion,1,0
Mr. Peanut is Dead For Some Reason,not onion,1,0
Police: Man high on ‘shrooms’ ‘pistol-whipped’ transgender woman who then wrestled the gun away,not onion,1,0
Saudi millionaire who said he 'accidentally tripped and penetrated' teenage girl cleared of rape,not onion,1,0
Hospital staff in Wuhan are wearing adult diapers because they don't have time to pee while caring for an overwhelming number of coronavirus patients,not onion,1,0
"Virginia Man Sues Local Paper, Reporter for Accurately Reporting His Family’s Slaveholding History",not onion,1,0
Massachusetts serial pooper busted for defecating in parking lot eight times,not onion,1,0
TikTok Teens Are Dipping Their Balls in Soy Sauce and Lighting Their Houses on Fire,not onion,1,0
Arizona man dresses up fake skeleton to drive in HOV lane,not onion,1,0
Mr. Peanut is Dead For Some Reason,not onion,1,0
Saudi millionaire who 'accidentally tripped and penetrated teen' cleared of rape,not onion,1,0
Massachusetts serial pooper arrested after police catch her defecating in parking lot,not onion,1,0
Arizona man dresses up fake skeleton to drive in HOV lane,not onion,1,0
Thai officials accidentally auction off car loaded with amphetamine,not onion,1,0
"Behold, the serial pooper",not onion,1,0
RIPeanut: Locals pay respects to Suffolk native Mr. Peanut after his unexpected death,not onion,1,0
RIPeanut: Locals pay respects to Suffolk native Mr. Peanut after his unexpected death,not onion,1,0
Hospital staff in Wuhan are wearing adult diapers because they don't have time to pee while caring for an overwhelming number of coronavirus patients,not onion,1,0
Guy says He Couldn't Let Laid So He Decided to Go Kill Women and Children Instead,not onion,1,0
Hospital staff in Wuhan are wearing adult diapers because they don't have time to pee while caring for an overwhelming number of coronavirus patients,not onion,1,0
Aussie Book Store Issues Apology After “Pick Up Artists” Caught Harassing Customers,not onion,1,0
This is the best timeline,not onion,1,0
A US town rejected solar panels amid fears 'they'd suck up all the energy from the sun',not onion,1,0
Inspiration behind Wolf of Wall Street files $300 million fraud suit over film funded by dirty money,not onion,1,0
FLORIDA TEEN STUNG OVER 600 TIMES AFTER INSERTING HIS PENIS INSIDE OF BEEHIVE,not onion,1,0
"The real 'Wolf of Wall Street' Jordan Belfort is suing the company that bankrolled the epic for FRAUD, claiming it damaged his reputation when the company was engulfed in its own financial scandal",not onion,1,0
Arizona man cited for using fake skeleton to drive in HOV lane,not onion,1,0
Bank calls cops on black man trying to cash check from discrimination lawsuit,not onion,1,0
A lot of objectives: Deerfield's offense a reasonable quality indeed,not onion,1,0
"2.8Million Infected and 112,000 DEAD in Coronavirus Outbreak in CHINA Jan.25,2020",not onion,1,0
Students studying how to raise chickens on Mars,not onion,1,0
Black man has cops called on him for trying to cash check for discrimination lawsuit,not onion,1,0
Most Crypto Markets Management Explains for Widely Thought,not onion,1,0
Local Man Arrested After Blaring “Benny Hill” Song Near People Slipping On Ice,not onion,1,0
Al Shabaab terror group bans single-use plastic bags | World News,not onion,1,0
Elderly woman survives fall from 7th story apartment window after landing on crate of fruit and vegetables,not onion,1,0
A high-profile murder case hinges on an alibi involving a googly-eyed grocery-store robot named Marty,not onion,1,0
oh dear,not onion,1,0
"Being 'muted' in a game does not violate your civil rights, US federal court declares",not onion,1,0
U.S. Space Force says its new seal is not a Starfleet knockoff,not onion,1,0
Justin Bieber's New Album Preview: Lots Of Tears &amp; Allusions To Married Sex,not onion,1,0
Pasta is now a vegetable in American schools under Trump guidelines,not onion,1,0
US Space Force logo looks like one from Star Trek,not onion,1,0
Mr. Peanut Suffers a Noble But Tragic Death in Planters Super Bowl Commercial,not onion,1,0
Fight over O’Charley’s dinner rolls leads to shooting death,not onion,1,0
Mr. Peanut is dead for some reason,not onion,1,0
Who doesn't love hearing yakty sax after they fall,not onion,1,0
"Firearms petition, introduced in southern Alberta, surpasses 100,000 signatures",not onion,1,0
Doctors beg men not to masturbate with banana peels,not onion,1,0
"Justin Bieber Cried Through His Album Playback, Then Excused Himself To Have Sex With His Wife",not onion,1,0
"Coronavirus patient in Hong Kong put in wrong ward, officials apologise",not onion,1,0
"Trump is the first president to attend an anti-abortion rally, calls himself defender of life.",not onion,1,0
German woman to marry airplane she met six years ago,not onion,1,0
Is Mr. Peanut really dead? Local enthusiasts smell a dry-roasted conspiracy,not onion,1,0
"Facebook and YouTube moderators are being asked to sign forms stating they understand the job could cause post-traumatic stress disorder (PTSD), according to reports.",not onion,1,0
Hospital staff in Wuhan are wearing adult diapers because they don’t have time to pee while caring for an overwhelming number of coronavirus patients,not onion,1,0
The governor's pitch: Fight climate change with coal,not onion,1,0
Brazil’s president Jair Bolsonaro ‘jokes‘ that “Indians are undoubtedly changing … They are increasingly becoming human beings just like us.”,not onion,1,0
Department for Education release a grime record to promote apprenticeships,not onion,1,0
Woman To Marry Plane She’s Been In Long-Distance Relationship With For Six Years,not onion,1,0
"Woman, 30, reveals plans to marry Boeing 737-800 she claims she’s been dating for past six years",not onion,1,0
Cosplayer and activist become the member of Taiwanese Parliament,not onion,1,0
Gwyneth Paltrow 'vagina-scented' candle woos Elton John,not onion,1,0
The former warden of the prison where Jeffrey Epstein died has a new job at another federal penitentiary,not onion,1,0
Doctors Urge Guys Not To Masturbate Into Banana Peels,not onion,1,0
Cosplayer becomes youngest member of Taiwan's parliament,not onion,1,0
"A father's concealed weapon went off when he was play-wrestling with his toddler, police say. Both were shot in the head",not onion,1,0
Virus-hit Wuhan has two laboratories linked to Chinese bio-warfare program,not onion,1,0
NFL’s Saints fight to shield emails in Catholic abuse crisis,not onion,1,0
Saints seek to prevent release of emails related to work on Catholic abuse crisis,not onion,1,0
Vietnamese police fine men filmed showering on moving motorbike,not onion,1,0
Department of Education drops a grime record to showcase power of apprenticeships,not onion,1,0
Eaten by crocodiles while walking on water like Jesus,not onion,1,0
Detroit Bank Calls Police on Black Man Depositing Payout From a Racial Discrimination Lawsuit,not onion,1,0
Reporter says Mike Pompeo cursed and demanded she find Ukraine on a map after interview,not onion,1,0
Australia plans to revive Satan's pet from extinction.,not onion,1,0
Scientists Confirm Mount Vesuvius Eruption Turned Victim's Brain Into Glass,not onion,1,0
Scientists Confirm Mount Vesuvius Eruption Turned Victim's Brain Into Glass,not onion,1,0
Nationwide Chinese criminal organization uncovered by Utah Walmart employees,not onion,1,0
Man uses sanitary towel as mask as residents in coronavirus city 'desperate',not onion,1,0
A Border Patrol agent who separated migrant families says it was 'the most horrible thing I've ever done',not onion,1,0
"Trump Unveils New Space Force Logo, Inciting 'Star Trek' Fan Outrage",not onion,1,0
"Amid coronavirus fears, sales rise for Plague Inc., a game about a deadly pathogen",not onion,1,0
Sydney bookstore tells dating agencies to stop practising pickup lines on customers,not onion,1,0
"Bigfoot spotted in Washington — again, state officials say. And this time there’s video",not onion,1,0
"This Acne miracle has 11,000 5 Star Reviews",not onion,1,0
"Goldman to Refuse IPOs If All Directors Are White, Straight Men",not onion,1,0
Mars Volta Singer Says His Dog Was Killed By Scientologists Protecting That ’70s Show Actor,not onion,1,0
‘Make better choices’: Endangered Hawaiian monk seals keep getting eels stuck up their noses and scientists want them to stop,not onion,1,0
"Psychologists who ""sold"" torture techniques to the CIA for $ 80 million",not onion,1,0
Sydney bookstore tells dating agency to stop practicing pickup lines on customers,not onion,1,0
Black man sues a bank for calling the cops on him for alleged fraud while trying to deposit a check that he won in a racial discrimination lawsuit.,not onion,1,0
Man says bank racially discriminated when they refused to cash checks from discrimination settlement,not onion,1,0
"Justin Bieber Cried Through His Album Playback, Then Excused Himself To Have Sex With His Wife",not onion,1,0
"Justin Bieber cried through his album playback, then excused himself to have sex with his wife",not onion,1,0
Arizona woman gets emergency surgery after vibrator gets stuck in her bladder,not onion,1,0
"Man deposits $980,000 check from IRS, lands prison sentence",not onion,1,0
"Your civil rights weren’t violated when you were muted out of a video game, U.S. court tells angry player",not onion,1,0
Gritty Accused of Punching 13 year old fan,not onion,1,0
I suspect the Onion may have written this story before it became reality,not onion,1,0
"Justin Bieber Cried Through His Album Playback, Then Excused Himself To Have Sex With His Wife",not onion,1,0
Trump says his advice to impeachment defense team is 'just be honest',not onion,1,0
YouTube moderators must sign contract acknowledging job could cause PTSD – report,not onion,1,0
Microsoft's newest internet browser is so good that I forgot I switched from Google Chrome,not onion,1,0
Mr. Peanut is dead for some reason,not onion,1,0
Pastor eaten alive by crocodiles while trying to walk on water like Jesus,not onion,1,0
Tempe Police Declare War on 'Penis Man',not onion,1,0
Popular Jamaican Dancer ‘Bumpa’ Dies During Daring Dance Move,not onion,1,0
Neo-Nazi Rinaldo Nazzaro running US militant group The Base from Russia,not onion,1,0
Elizabeth Holmes phones in her civil-trial defense after lawyers quit over pay,not onion,1,0
Theranos founder Holmes phones in to court hearing solo after lawyers say she stiffed them: report,not onion,1,0
Elizabeth Holmes Phones In Her Defense After Civil Lawyers Quit,not onion,1,0
Tennessee governor signs anti-LGBT adoption bill,not onion,1,0
"No big deal, Rogers, your internal source code and keys are only on the open web. Don't hurry to take it down",not onion,1,0
'Take her out': Recording appears to capture Trump at private dinner saying he wants Ukraine ambassador fired,not onion,1,0
Vietnamese police fine men filmed showering while riding motorbike,not onion,1,0
4 vice police officers disciplined for 'improper' Stormy Daniels arrest at strip club,not onion,1,0
"Justin Bieber Cried Through His Album Playback, Then Excused Himself To Have Sex With His Wife",not onion,1,0
"Former Wells Fargo CEO John Stumpf banned for life from banking, ordered to pay $17.5M",not onion,1,0
"This Acne miracle has 11,000 5 Star Reviews",not onion,1,0
"The suspect who killed 3 teens drove into them after they 'ding-dong ditched' his home, district attorney's office says",not onion,1,0
"Reporter moves to and lives in county he claimed was ""the worst place to live in America""",not onion,1,0
"ISIS encouraging followers to set wildfires in forests, fields of US, Europe",not onion,1,0
"A black man received a settlement in a race discrimination lawsuit. When he tried to cash the check, the bank called the cops, prompting a second racial discrimination case.",not onion,1,0
Kelowna hotel to award couples for baby-making with Nooner deal,not onion,1,0
Gwyneth Paltrow 'vagina-scented' candle woos Elton John,not onion,1,0
"“If I Can’t Live, Then You Can’t Too!” Patient with Fever Tears Off Medical Staff’s Mask &amp; Spits At Her",not onion,1,0
Church is closing to remodel and rebrand; invites older members to not return in an effort to gain a younger following.,not onion,1,0
Indian man dies after getting attacked by his rooster on their way to a cockfight,not onion,1,0
US Space Force logo looks like one from Star Trek,not onion,1,0
Local Man Arrested After Blaring “Benny Hill” Song Near People Slipping On Ice,not onion,1,0
British empire mmmkay,not onion,1,0
Wut,not onion,1,0
Mike Pompeo Dares Veteran Foreign Correspondent to Find Ukraine on Map (She Does),not onion,1,0
YouTube moderators are reportedly told to sign a form accepting that the job can give them PTSD.,not onion,1,0
Why did an Ashland woman allegedly use a Natick store lot as a toilet? No one knows.,not onion,1,0
The former lieutenant governor of Pa. is now doing stand-up comedy in California,not onion,1,0
"Mathematicians have solved traffic jams, and they’re begging cities to listen. Most traffic jams are unnecessary, and this deeply irks mathematicians who specialize in traffic flow.",not onion,1,0
US Space Force logo looks like one from Star Trek,not onion,1,0
Tempe Police Declare War on 'Penis Man',not onion,1,0
A Bank Called the Cops on a Black Man Trying to Deposit the Money He Won in a Discrimination Lawsuit,not onion,1,0
Trump Revealed the Logo for Space Force and It's Just the Star Trek Logo,not onion,1,0
Trump Revealed the Logo for Space Force and It's Just the Star Trek Logo,not onion,1,0
Trump debuts Space Force logo — and it’s literally a ripoff of Star Trek,not onion,1,0
Table for 2: Waffle House offers romantic Valentine's Day dinner,not onion,1,0
Table for 2: Waffle House offers romantic Valentine's Day dinner,not onion,1,0
Trump Space Force logo looks like Star Trek Starfleet symbol,not onion,1,0
East Freetown’s First Firehouse Suffers $500k in Fire Damage,not onion,1,0
UK royals hold an online poll for the naming of a research ship... and the name turns out to be Boaty McBoatface,not onion,1,0
Trump just revealed the logo for the Space Force and it looks like the Star Trek symbol,not onion,1,0
Mechelen housing estate once again plagued by ducks,not onion,1,0
Al Shabaab terror group bans single-use plastic bags | World News,not onion,1,0
'PRICASSO': Simon Cowell leaves 'Britain's Got Talent' after man paints with penis at audition,not onion,1,0
"Oakland's rulers want to ban landlords from checking if renters have criminal history, naming the idea "" Fair Chance Housing Ordinance""; Vice Mayor says the measure will ""make a huge difference in the life of his son, who is incarcerated and set to come home soon"".",not onion,1,0
Preacher believes Trump was merely sharing gospel with porn star,not onion,1,0
Great Moments in Robot-Penis History,not onion,1,0
Pasta is now a vegetable in American schools under Trump guidelines,not onion,1,0
The former lieutenant governor of Pennsylvania is now doing stand-up comedy in California as ‘Mikey Stacks’,not onion,1,0
"Your civil rights weren’t violated when you were muted out of a video game, U.S. court tells angry player",not onion,1,0
Vegas casino says O.J. Simpson too tarnished to defame,not onion,1,0
"She’s a serial public pooper, MA cops say. Lawyer calls her a ‘pillar of the community’",not onion,1,0
A black man in Michigan tried to deposit checks at his bank. The manager called police.,not onion,1,0
Halsey accidentally called for another 9/11 while trying to shade a review of her new album,not onion,1,0
"The weird and dangerous side of TikTok, featuring soy sauce, cereal and electrical outlets",not onion,1,0
Japanese billionaire giving away $9M to Twitter followers in 'social experiment',not onion,1,0
