title,tag,score,y
Sex offender expert arrested on child abuse charges,us news,1,0
"Elizabeth Hurley, 54, strips down for racy Christmas message: ‘Sexiest woman ever’",us news,1,0
"Woman, 36, abandoned in dumpster as a baby searches for the person who saved her life",us news,1,0
"Woman shot when dog jumps on car console, firing gun",us news,1,0
Suspect caught in slaying of NFL player's brother,us news,1,0
A Hidden Camera Caught These Restaurant Workers Spitting In A Police Officer's Food,us news,1,0
What Americans spend on holiday decorations,us news,1,0
Across the Country Harsh Sentencing Laws are Tearing Apart Families and Communities,us news,1,0
Virginia Governor Northam Increases Corrections Budget In Anticipation Of Jailing Gun Owners,us news,1,0
"San Francisco, Hostage to the Homeless",us news,1,0
Trump-Hating NY Times Pouts Trump Doesn’t Throw Christmas Parties for Journalists,us news,1,0
Feds probe housing development's Christmas-light ban,us news,1,0
New documents reveal a covert British military-intelligence smear machine meddling in American politics,us news,1,0
"Porch pirates with more than 100 pieces of loot flip car in police chase, CA cops say",us news,1,0
Germans think Trump is more dangerous than Putin,us news,1,0
Former GOP Michigan congressman says Trump is unfit for office,us news,1,0
"NRA collapsing under scandal, criminal investigation",us news,1,0
"In 2020, It’s Time to Make Universal Healthcare a right",us news,1,0
"TOXMAP, Federal Database Allowing Public to Track U.S. Pollution, Shut Down After 15 Years by Trump Administration",us news,1,0
"Suspect in fatal hit-and-run had been deported 6 times, according to ICE",us news,1,0
A Colorado radio host wished for a 'nice school shooting' to disrupt Donald Trump impeachment coverage. He was fired,us news,1,0
91 Fortune 500 companies paid no federal income tax in 2018,us news,1,0
How Trump has betrayed the working class,us news,1,0
Giuliani says he's 'more of a Jew' than Holocaust survivor George Soros,us news,1,0
A motorist accused of running over a girl because she 'was a Mexican' is now charged with hitting a black child,us news,1,0
Hate crime charges pending for woman who intentionally crashed into 2 children,us news,1,0
"U.S. mass killings hit new high in 2019, most were shootings",us news,1,0
The States Most Likely to Have a White Christmas #usa #news,us news,1,0
"Dramatic Video Shows Muslim in US on Student Visa Violently Attack Arizona State Trooper, Forcing Officer to Shoot and Kill Him (VIDEO)",us news,1,0
Bloomberg Campaign Caught Using Prison Labor To Make Spam Phone Calls,us news,1,0
Andrew Yang overtakes Pete Buttigieg to become fourth most favored primary candidate: Poll,us news,1,0
Michael Bloomberg used prisoners to make phone calls for 2020 campaign,us news,1,0
Mike Bloomberg Exploited Prison Labor to Make 2020 Presidential Campaign Phone Calls,us news,1,0
Obama Insider Confirms Former President Ready to Back Whoever Wins 2020 Nomination—Even Bernie Sanders,us news,1,0
President Trump rolling back over 80 environmental regulations,us news,1,0
British teenager dies during school trip to New York,us news,1,0
EPSTEIN ‘ADMITTED TO ME’ HE WAS A SPY: Ex-Business Partner,us news,1,0
Blind mystic Baba Vanga's predictions for 2020 - after foreseeing 9/11 and Brexit,us news,1,0
EPSTEIN ‘ADMITTED TO ME’ HE WAS A SPY: Ex-Business Partner,us news,1,0
"Federal Policies Threaten Hawaii’s Flora, Fauna #usa #news",us news,1,0
Guess who paid for Donald Trump's crazy-corrupt Mar-a-Lago Christmas party? We did,us news,1,0
Boeing chief fired but 737 concerns persist,us news,1,0
Hunter Biden Denies Ukraine Money Laundering Allegations,us news,1,0
Rudy Giuliani says he's more of a jew than George Soros: report,us news,1,0
Cedar Rapids woman going to federal prison for selling meth,us news,1,0
House counsel suggests Trump could be impeached again,us news,1,0
Tape reveals Trump advisor discussing “aggressive” voter suppression in 2020 election cycle,us news,1,0
‘It absolutely shocks the senses’: Kansas child abuse law failed baby with 31 fractures,us news,1,0
Grim Christmas again for kids 'cheated' out of childhood by W. Virginia's opioid crisis,us news,1,0
Health officials warn of measles exposure at 5 US airports,us news,1,0
'I want his head on a platter': Kentucky mom tells 911 dispatcher of suspect who took her baby in carjacking,us news,1,0
Scaramucci reveals four witnesses whose testimony could force Trump to resign,us news,1,0
"‘If they have to testify under oath, he has to leave': Scaramucci reveal",us news,1,0
Newly released emails provide details in White House pause of Ukraine aid,us news,1,0
Rev Al Sharpton Questions Religious Conservatives Supporting Trump: Are You 'Selling Your Soul for Some Judicial Appointments?',us news,1,0
Navy Pilot Who Filmed the ‘Tic Tac’ UFO Speaks: ‘It Wasn’t Behaving by the Normal Laws of Physics’,us news,1,0
"A NYPD officer Michael Reynolds goes to Nashville for a bachelor party, breaks into Black family's home while blackout drunk, threatens to kill mother and her small children, &amp;amp; calls them “fucking nig***s.” He only got 2 weeks in jail &amp;amp; he's still employed by the NYPD.",us news,1,0
How Trump is filling the liberal 9th Circuit with conservatives,us news,1,0
Trump Suffers Neurological Malfunction with Full Spasm,us news,1,0
"‘If they have to testify under oath, he has to leave': Scaramucci reveal",us news,1,0
Democratic Sen. Doug Jones says he'll vote to acquit President Trump,us news,1,0
"Police: Gunmen opened fire on crowd in Baltimore, injuring 7",us news,1,0
GOP Rep. condemns Trump's indifference to Russian meddling,us news,1,0
The secret US prisons you've never heard of before | Will Potter,us news,1,0
Angry Christian Complains About Woman’s ‘Demonic’ Dragon Christmas Display,us news,1,0
Klobuchar voted to confirm nearly two-thirds of Trump’s judicial nominees,us news,1,0
Navy SEAL at center of war crimes case meets with Trump at Mar-a-Lago,us news,1,0
Stephen Miller hatched secret plan to embed ICE agents at refugee agency for children: report,us news,1,0
Russian feminist punk band Pussy Riot endorses Bernie Sanders for president,us news,1,0
Minnesota voter sues over Trump-only GOP primary ballot,us news,1,0
Trump admin blocks expanded rules against inefficient lightbulbs,us news,1,0
The New York Times Affirms: 'Soros &amp; Clinton Paid Woman To Accuse Trump Of Sexual Attack',us news,1,0
New Republic Writer Hilariously Triggered by Melania Trump's Christmas Decorations Video,us news,1,0
"Elizabeth Warren in hypocrisy row after it's revealed she held $2,700 per head fundraiser at Boston winery – but berated fellow 2020 candidate Pete Buttigieg for his 'wine cave' fundraiser",us news,1,0
US Rare Earth Element Processors to Help Break China Stranglehold,us news,1,0
"Catherine Pugh, Former Baltimore Mayor, Charged With Perjury In ‘Healthy Holly’ Scandal",us news,1,0
"""I've Seen the Documents"" - Rep. Ratcliffe Confirms Obama Deep State Was Lying and Spying on Trump Camp Way Before Opening Crossfire Hurricane",us news,1,0
Researcher: Data on 267 million Facebook users exposed,us news,1,0
Iowa voters,us news,1,0
It is hard to capture how bizarre and frightening Trump’s letter to Pelosi is,us news,1,0
Leaked audio: Trump adviser says Republicans rely on voter suppression,us news,1,0
National Review Senior Editor Calls for Trump’s Removal from Office,us news,1,0
Police: 13 people shot at house party in Chicago,us news,1,0
BREAKING- CNN Poll Shows Trump US Economy Has The Highest Ranking In Nearly 20 Years,us news,1,0
Driving While High a Public Health Problem #usa #news,us news,1,0
Donald Trump Is the First Home Alone 2 Actor to Be Impeached!,us news,1,0
At least 6 killed in Las Vegas apartment fire,us news,1,0
Number of far-right referrals to counter-extremism programme hits record high,us news,1,0
Amazon Conference Badges Tracked Attendees' Movements,us news,1,0
Trump blasts Christian magazine that called for his removal,us news,1,0
Trump Is Readying Some Kind Of Homeless Crackdown | But his new homelessness czar won’t share any details about it.,us news,1,0
Dallas-Fort Worth median home prices unaffordable for average wage earners,us news,1,0
Fort Worth police officer who fatally shot Atatiana Jefferson indicted on murder charge,us news,1,0
BLAST ON PAULINA GRETZKY BIRTHDAY,us news,1,0
Esper: IG Not Questioning Legality of Trump’s Border Deployment #usa #news,us news,1,0
"Health care costs under job-based plans have grown rapidly, while wages remained flat",us news,1,0
"This Story on Cellphone Tracking 'Is the Most Important Article You Should Read Today. Period.' The New York Times published the first piece in its ""One Nation, Tracked"" investigation based on a data set with over 50 billion location pings.",us news,1,0
Jeffrey Epstein's Suicide Attempt Surveillance Footage Missing,us news,1,0
A Vote of Conscience: The Real Reason Gabbard Did Not Vote to Impeach Trump,us news,1,0
Vigilante Teen Kills Pedophile Who Sex Trafficked &amp;amp; Raped Her - Faces Life In Prison,us news,1,0
President Trump Signs Defense Bill Creating Space Force,us news,1,0
Leaked audio: Trump adviser says Republicans 'traditionally' rely on voter suppression,us news,1,0
Meghan McCain Says Melania Is Complicit in Trump's Bullying,us news,1,0
Nancy Pelosi turns up the heat on Trump and the Republicans — and it's working,us news,1,0
Medical marijuana headed to the 2020 ballot in South Dakota,us news,1,0
Fort Worth police officer who fatally shot Atatiana Jefferson indicted on murder charge,us news,1,0
"Calling Trump 'Morally Lost,' 'Christianity Today' Editor Calls For His Removal",us news,1,0
Has the Trump phenomenon made all Americans 'useful idiots'?,us news,1,0
"Washington State Rep. Matt Shea Engaged In Domestic Terrorism, Report Says | The GOP state representative helped plot Ammon Bundy’s 2016 takeover of a rural wildlife refuge.",us news,1,0
Stacked or Side by Side: Laundered Money Doesn’t Come Clean,us news,1,0
Man allegedly donates testicle to protest Trump’s impeachment,us news,1,0
Canadian Military Investigating Soldier After Posts on Neo-Nazi Forum,us news,1,0
"NYT tracked Trump with leaked data, shows phone spying is easy",us news,1,0
Bowling Green woman accused of stabbing man,us news,1,0
Caught On Camera: Drug raid gone wrong,us news,1,0
"U.S. megachurch seeks $100K, prayers to ‘resurrect’ singer’s dead child",us news,1,0
"Deputy sheriff allegedly scoured obits, broke into homes of people at funerals",us news,1,0
"Suit: Police barged into Kansas home, beat man for no reason",us news,1,0
Clive police: woman admits to hitting 14-year-old with car because she was a 'Mexican',us news,1,0
New civil lawsuit alleges Harvey Weinstein sexually assaulted a 16-year-old Polish model in 2002,us news,1,0
'I want his head on a platter': Kentucky mom tells 911 dispatcher of suspect who took her baby in carjacking,us news,1,0
UK charges US diplomat’s wife over teen’s death in crash,us news,1,0
Vegan parents accused of starving child to death on diet of fruit and vegetables,us news,1,0
"Pelosi calls for fair Senate trial, does not reject withholding",us news,1,0
The Air Force is moving to discharge airman investigated for white nationalist ties,us news,1,0
Twitter Reveals Bug in Android App That Could Let Hackers Hijack User Accounts,us news,1,0
Brad Pitt spent a low-key birthday with just some of his kids: report,us news,1,0
Congress passes bill raising minimum tobacco and vape smoking age to 21,us news,1,0
Driver who fatally struck 3 siblings at school bus stop gets 4 years in prison,us news,1,0
American Airlines Mechanic Pleads Guilty to Jetliner Sabotage,us news,1,0
Fifteen years in Iowa jail for burning pride flag,us news,1,0
Trump should be removed from office,us news,1,0
Adult Survivors Act: New Jeffrey Epstein accusers push for protections for adult sex abuse survivors,us news,1,0
"After her defense of Trump mocking a disabled child, Melania earns her title as Ugliest First Lady",us news,1,0
Rashida Tlaib was right: We impeached the motherfucker,us news,1,0
"As impeachment passes, Pelosi warns Dems: No cheering from the bench",us news,1,0
Russia’s State TV Calls Trump Their ‘Agent’,us news,1,0
Trump: 'It doesn't really feel like we're being impeached',us news,1,0
President Trump impeached in historic vote by sharply divided House,us news,1,0
A Colorado radio host wished for a 'nice school shooting' to disrupt Donald Trump impeachment coverage. He was fired,us news,1,0
"Trump impeached by the House for abuse of power, obstruction of Congress",us news,1,0
Man accused of killing transgender teen girl after 'hookup meeting': Police,us news,1,0
Trump is impeached,us news,1,0
President Donald Trump Impeached in the House of Representatives #usa #news,us news,1,0
Rudy Giuliani—and Russia—Pay Close Attention to This Ukrainian Conspiracy-Peddler,us news,1,0
"President Trump has been impeached under two different charges, making him the third president to have been impeached in US history.",us news,1,0
"President Trump has now been impeached for two separate charges, making him the third president to have been impeached in US history. https://www.cnn.com/2019/12/18/politics/house-impeachment-vote/index.html",us news,1,0
House Majority Leader Steny Hoyer (D-MD) on Impeachment,us news,1,0
One vote down,us news,1,0
Arkansas Sheriff Accused of Assaulting 3 Faces Federal Charges,us news,1,0
"Seoul, Washington fail to agree on cost of U.S. troops; U.S. 'not focused",us news,1,0
&gt;boom&lt; impeachment update,us news,1,0
"Activists Cheer Approval of Driver’s Licenses for Undocumented Immigrants in New York, New Jersey",us news,1,0
Trump impeachment: US House ready for historic vote,us news,1,0
House passes pair of funding bills to avert government shutdown,us news,1,0
Giuliani Hints at New Defense: So What If Trump Did It?,us news,1,0
YUGE Crowds gather in Cincinnati to support impeachment,us news,1,0
See Trump's claim that won him an award,us news,1,0
"Mormon Church accused of stockpiling billions, avoiding paying taxes",us news,1,0
"It will be 257 years before women have equal pay, new report says",us news,1,0
FISA Court Rebukes FBI,us news,1,0
FISA Court Rebukes FBI,us news,1,0
U.S. Congress pressures Trump to renew Russia arms control pact,us news,1,0
'The Speech': How Sanders' 2010 Filibuster Elevated His Progressive Profile,us news,1,0
Trump protests impeachment in ranting letter to Pelosi,us news,1,0
Trump: I take zero responsibility for impeachment.,us news,1,0
Boris Johnson Determined to Steer a Hard Brexit #usa #news,us news,1,0
Trump pens irate impeachment letter to Pelosi,us news,1,0
Hundreds gather across N.J. for Trump impeachment rallies,us news,1,0
"A Methane Leak, Seen From Space, Proves to Be Far Larger Than Thought - The Ohio blowout released more methane than the reported emissions of the oil and gas industries of countries like Norway and France",us news,1,0
Couple charged after spending money bank accidentally put in their account,us news,1,0
Pedophile Turns Himself In After Shane Coyle Exposes Him On Facebook,us news,1,0
"For 20 years, a Tennessee baby thief kidnapped more than 5,000 children from the streets, hospitals, and shanty towns of Memphis. Now, 70 years later, survivors of her 'house of horrors' are confronting the past.",us news,1,0
"‘Killer Grandma’ Lois Riess Pleads Guilty To Murdering Florida Woman, Stealing Her Identity – WCCO",us news,1,0
Michigan sues four firms including Walgreens over deadly opioid epidemic | US news,us news,1,0
Trump sends wild letter to Nancy Pelosi on eve of impeachment,us news,1,0
Girl who was dragged into car has been found,us news,1,0
Special needs students at a Pizza Hut were allegedly told to hurry up for 'regular' people,us news,1,0
Three killed as tornadoes sweep southern US,us news,1,0
Possible 'white power' hand signs at Army-Navy game probed,us news,1,0
Possible mass grave from 1921 Tulsa Race Massacre found by researchers,us news,1,0
Vaping increases the risk of lung disease by a third: U.S. study,us news,1,0
Democratic Rep. Slotkin faces rowdy town hall after announcing,us news,1,0
Photos Leaked From Pete Buttigieg's Closed-Door Napa Valley Fundraiser,us news,1,0
"Boeing May Suspend 737 MAX, But Consumer Advocate Ralph Nader Wants a Total Recall of Deadly Planes",us news,1,0
Americans plan demonstrations in support of impeaching Trump,us news,1,0
Aurora police chief in email defends decision to keep officer found passed out drunk in police car while on duty,us news,1,0
"AT&amp;T's DIRECTV Price Has Gone Up Almost $20 a Month Since January 1, 2019",us news,1,0
"AT&amp;Tâs DIRECTV Price Has Gone Up Almost $20 a Month Since January 1, 2019",us news,1,0
Massive bill calls for $1.4 trillion in federal spending,us news,1,0
"We Are Republicans, and We Want Trump Defeated",us news,1,0
The reason why smart TVs are so affordable: They track your data,us news,1,0
"Ex-boyfriend held woman at gunpoint, forced her to take pills resulting in miscarriage",us news,1,0
Police: Florida parking officer extorted valet for cash,us news,1,0
"Russian state media calls Trump a Moscow ""agent,"" jokingly suggests he'll need to flee to their country after leaving office",us news,1,0
Trump Casually Threatens to Throw James Comey in Jail,us news,1,0
"Whistleblower claims that LDS Church stockpiled $100 billion in charitable donations, dodged taxes",us news,1,0
Queens Congresswoman Alexandria Ocasio-Cortez talks public housing legislation at Sunnyside town hall,us news,1,0
Florida man died from meth overdose before he was eaten by alligator,us news,1,0
"Impeachment Headed Toward Inevitability in House, Uncertainty in Senate #usa #news",us news,1,0
"Loons likely to disappear from Minnesota due to climate change, new report warns",us news,1,0
Sanders surges ahead of Iowa caucuses,us news,1,0
Dems Tells Federal Court Mueller’s Secret Grand Jury Materials Could Lead to Second Impeachment,us news,1,0
Robert Mueller’s Top Lieutenant Believes Trump Committed Federal Crimes While in Office,us news,1,0
Trump Moves to Strip Hundreds of Thousands of Social Security Benefits,us news,1,0
"Woman arrested after hitting student on the head with stun gun ""numerous times,"" police say",us news,1,0
Chinese Woman Released From Jail After Being Sentenced for SoCal ‘Birth Tourism’ Scheme,us news,1,0
"Elected official&amp;#x27;s wife dumped drink on reporter&amp;#x27;s head, faces criminal charges",us news,1,0
A black woman faces prison because of a Jim Crow-era plan to ‘protect white voters’,us news,1,0
Indiana University investigating alleged incident of anti-Semitism at fraternity,us news,1,0
South Beach Diet vs. Nutrisystem #usa #news,us news,1,0
Buy Soma Online Cheap To Tone Your Skeletal Muscle,us news,1,0
Saudi Student in New Mexico Arrested With Handgun &amp;amp; Hit List | Clarion Project,us news,1,0
"California DMV ""Accidentally"" Re-Registering Hundreds Of Voters As Non Affiliated",us news,1,0
'Atrocious': 188 Democrats Join GOP to Hand Trump $738 Billion Military Budget That Includes 'Space Force',us news,1,0
"Bernie Nets Huge Endorsement Of 600,000 Families",us news,1,0
"Boy, 13, arrested in New York college student stabbing death",us news,1,0
"In surprise decision, US approves muscular dystrophy drug",us news,1,0
Dozens of unlicensed cannabis dispensaries raided in L.A. this week,us news,1,0
Trump supporter grabs spotlight at Sanders event with a message for the president,us news,1,0
Supreme Court to Rule on Release of Trump Financial Records #usa #news,us news,1,0
Transgender Activist Facing 50 Years In Prison For Raping 4 Year Old Girl On Video,us news,1,0
Netanyahu-Pompeo Meeting Solidifies War Plan on Iran,us news,1,0
Trisha paytas accidentally flashes on TikTok and apologizes,us news,1,0
Racist Memes Could Be the Key to Convicting a White College Student of Stabbing a Black Man to Death,us news,1,0
"Woman accused of shoplifting during ""shop with a cop"" event",us news,1,0
Powerful 7.7M earthquake hits between Cuba and Jamaica,world news,9,0
Powerful earthquake hits between Cuba and Jamaica,world news,4,0
"Australian lab first outside of China to re-create coronavirus, helping vaccine push",world news,33,0
Palestinian President Abbas rejects Donald Trump ‘s plan: “Jerusalem is not for sale. Your conspiracy deal will not pass”,world news,67,0
Tsunami warning as 7.7 magnitude earthquake hits Jamaica,world news,69,0
"In peace bid, Trump proposes Palestinian state with capital in eastern Jerusalem",world news,1,0
7.7 Magnitude Earthquake Report off South Coast of Cuba,world news,7,0
This grocery store wanted to compete with Whole Foods. Now it's going bankrupt #usa https://ift.tt/2KUz4QH,world news,1,0
Powerful earthquake hits between Cuba and Jamaica,world news,11,0
"Netanyahu formally indicted in court on corruption charges. Israeli PM withdrew his bid for immunity on Tuesday, hours before Knesset due to hold debate.",world news,10,0
WHO admits error in assessment of deadly coronavirus risk,world news,30,0
Jamaica hit by 7.7 magnitude earthquake,world news,1381,0
تسريب Resident Evil 8: لن تحمل هذا الاسم.. وستتضمن وحشًا على شكل ذئب!,world news,1,0
Wuhan seafood market may not be source of novel virus spreading globally,world news,18,0
Trump’s Israeli-Palestinian peace plan,world news,1,0
"Major earthquake, 7.7 mag has occurred near Lucea in Jamaica",world news,74,0
"Acclaimed Harvard Scientist Is Arrested, Accused Of Lying About Ties To China",world news,14,0
7.3 magnitude earthquake recorded near Cuba,world news,21,0
Netanyahu drops request for immunity on corruption charges. Israeli prime minister says he is withdrawing his bid for immunity hours before Knesset due to hold debate.,world news,6,0
Jamaica hit by 7.3 earthquake,world news,1,0
"Australian lab first outside of China to re-create coronavirus, helping vaccine push",world news,36,0
"First Coronavirus patient found in British Columbia, Canada",world news,1,0
AJJ Interview About ‘Good Luck Everybody’ Album: Emerging Artists Spotlight,world news,1,0
Scotland is on track to hit 100% renewable energy this year,world news,102,0
"Somalia could be sitting on up to 100 billion barrels of oil, a figure that would put them as containing the 7th largest oil reserves in the world.",world news,20,0
Indonesia's Aceh unveils new female flogging squad. Eight women -- all Sharia officers -- agreed to be floggers and were trained in the appropriate technique and advised how to limit injury.,world news,16,0
7.3 magnitude earthquake south of Jamaica,world news,41,0
Trump proposes Palestinian state with capital in East Jerusalem,world news,1,0
Jalisco Fiasco Daily 28-01-2020,world news,1,0
Magnitude 7.3 Earthquake Hits of The Coasts of Cuba and Jamaica,world news,1,0
Israeli settlers torch Palestinian school in latest 'price tag' attack,world news,18,0
A place in the sun: French defend right to retire early,world news,5,0
How the Trump Administration's Israel-Palestine Peace Plan Will Change the Middle East.,world news,0,0
Denmark refuses to apologise to China over coronavirus cartoon,world news,95,0
Miami University students tested for possible coronavirus,world news,0,0
Ex-FDA chief worries China greatly underestimating coronavirus cases by 'tens of thousands',world news,24,0
Trump proposes Palestinian state with capital in eastern Jerusalem,world news,17,0
Maduro rejects Europe ultimatum,world news,1,0
Ontario school board concerned parents' petition prompted by coronavirus fears could stoke racism,world news,0,0
Coronavirus: UK warns against travel to China,world news,1,0
"BC reports first Coronavirus case in Vancouver region, the third case for Canada",world news,16,0
"China coronavirus - ""Not only has the virus spread around China, so too has misinformation""",world news,16,0
Jordan says two-state solution only path to Mideast peace,world news,9,0
Celebrities Skincare Need To Know 9 Amazing Hollywood Celebrities..........,world news,1,0
#Bernie2020#PoliticalRevolurion#FeeltheBern,world news,1,0
Trump proposes Palestinian state with capital in East Jerusalem,world news,8,0
Chinese city Tianjin places Hospital under military management,world news,12,0
Coronavirus: UK warns against travel to China,world news,26,0
"Women are no threat to existence of men, says Sanwo-Olu",world news,1,0
"@TotesTravel : United Airlines cuts some China flights as demand falls amid coronavirus - United Airlines on Tuesday said it would suspend dozens of China flights next month because of a ""significant decline in... #TravelNewsInsights - https://t.co/IiSbI909Qd",world news,1,0
Trump reacts to Pompeo’s tirade against NPR reporter: ‘You did a good job on her’,world news,14,0
Ronja und Lissi in Hofgeismar weggelaufen,world news,1,0
يناير يودع سوريا بامطار وثلوج... اليكم درجات الحرارة,world news,1,0
"Trump unveils Mideast plan, hailing 'big step towards peace' - France 24",world news,1,0
How to Train Your Older Cat to Accept a Kitten comment bellow,world news,1,0
"East Africa gripped in locust plague infestation, worst in 70yrs.",world news,15,0
An explosion has been reported in the Hague: Fire department,world news,1,0
Qatar ruler appoints top aide as prime minister,world news,1,0
Health officials 'confident' first case of coronavirus has been found in B.C. | CBC News,world news,19,0
Sharia Law Horror: Indonesia Hires Female Floggers to Publicly Whip Women for Morality Crimes,world news,19,0
Saudi minister says Israeli passport holders cannot visit,world news,1,0
Chinese tourist in 'serious condition' in France's fourth coronavirus case,world news,24,0
Trump offers two-state peace plan for Israeli-Palestinian conflict amid skepticism,world news,0,0
